,month,heading,content
7,-2013-3-page-3-,"['Archives', 'TBI Inspiring Women: Nivedita Choudhary – From Air Force Officer To Mountaineer']","['Today is International Women’s Day. We have been celebrating the spirit of women all of this week by profiling amazing, gritty and inspiring ladies. Earlier in the week, you read about the courageous Preeti Monga and the fearless Sunitha Krishnan. We are also giving our readers a chance to grab a copy of the biography of one of the most resolute and awe-inspiring women of today – Aung San Suu Kyi in this giveaway. Today, we tell you the story of another adventurous woman, an IAF officer who has scaled many heights, including the daunting Mt. Everest!', '“It was truly a top-of-the-world feeling. Not a cloud in the sky, no obstruction between the horizon and me… Sitting on the platform I had made with my ice-axe, I had a clear, 360-degree view. I knew my life would change after that moment.”', 'Life did change. Flight Lieutenant Nivedita Choudhary became the first woman from the Indian Air Force (IAF) to summit the Mt. Everest – and the first woman from Rajasthan to achieve this feat. In fact, she was feted by the state chief minister for her rare achievement. “The one hour I spent on world’s highest point etched my name in history. It will always be the best moment of my life,” she says with a smile.', 'It was in October 2009 that Choudhary, an IAF officer who had just joined the squadron in Agra, chanced upon a broadcast calling for volunteers for IAF’s women expedition to the Everest. She volunteered for the extreme adventure activity “just like that” — without realising that, three years later, she would do what no woman in the air force had ever done. The other women Everest summiteers on her team, Squadron Leader Nirupama Pandey and Flight Lieutenant Rajika Sharma, climbed the peak five days later.', 'Of course, these are not the only firsts to Choudhary’s name. Just a year earlier, she had been the first and only IAF officer to date to scale the 7,557-metre Mt. Kamet, India’s highest climbing peak. Recalls the 27-year-old, who went to a government girls’ school in Jaipur,', 'Kamet was more eventful than Everest. The weather was very bad. There were no ropes and the route was full of hidden crevasses. Half way, we considered aborting the attempt. I had an Army ‘jawan’ (soldier) and an airman with me. As the senior-most in the team, I had to take a call. We could have been lost in the snow or have fallen into a crevasse since we couldn’t see a thing. But I thought, let’s do it. I was thinking a successful ascent would erase the memories of the previous attempt in 2005 when the IAF team had been caught in severely turbulent conditions and had to be rescued. I am happy I took the risk.', 'On the descent, though, the mountaineers did meet up with a rescue team looking out for them with high-intensity lights and whistles.', 'For Choudhary, the Kamet expedition was a precursor to the Everest mission. Incidentally, it was the third expedition for the IAF women mountaineering team after Mt. Stok Kangri (6,153 metres) in August 2010 and Mt. Bhagirathi-II (6,512 metres) in September-October 2009. Before she started off on her mountaineering trips Choudhary had undergone a month-long training in basic mountaineering in Darjeeling in November 2009 and it was on the basis of her performance there that she had made the cut for the Everest expedition. The Everest expedition was flagged off a day after she turned 26 on April 13, 2011. Thirty-seven days later, she was literally on top of the world.', 'The youngest woman on the team — comprising eight women officers, one medical officer and eight male soldiers — Choudhary gives a blow-by-blow account of the attempt. “We were at south col on May 20. The weather was initially bad, with wind speeds of 40-50 knots. Our team leader, Group Captain Dahiya, was in two minds. We started walking from the summit camp (8,000 metres) at 10 p.m. after the wind calmed a little. My Sherpa didn’t take oxygen. After two hours, his body gave up. I looked back and there was no one behind me. My spare oxygen bottle was also with him,” she recalls.', 'Undeterred, she decided to trace her way back a little and look for him. It was only after an hour of descend that Choudhary found him. “I gave him oxygen and waited another hour before the two of us began our ascent. At 3 a.m., I was at the balcony, the only place where climbers can stand straight — otherwise it’s all inclines of 60-70 degrees. Finally, at 8 a.m., I had conquered the world’s highest mountain peak,” she says.', 'Corporal Raju Sindhu summited an hour later. Squadron Leader Nirupama Pandey and Flight Lieutenant Rajika Sharma along with Squadron Leader D. Panda, Sergeant Jasbir Singh and Corporal Ganesh Pokhariyal, triumphed five days later. The entire IAF team, which had followed the southeast ridge route — Edmund Hillary and Tenzing Norgay had used this route in 1953 during the first Everest ascent — despite facing technical challenges thrown up by the extremely volatile Khumbu icefall, had successfully put seven climbers on the Everest.', 'Choudhary, today, is a firm believer that women make successful mountaineers, “I would say, it’s easier for women (to scale such heights). It’s more a mind game than entailing physical strength, and women are always mentally more stable and can take more stress than men.”', 'Mountaineering, however, was never her first love; it was the skies that had captured her imagination. Although she had completed her Bachelor’s degree in Technology from Jaipur’s Arya Engineering College, engineering was always her second option when it came to a career. Her heart was set on being an officer in the Air Force.', 'I was in the NCC Air Wing in college and I got a chance to fly a little bit. It entailed just one or two sorties in a Super Dimona aircraft, but I decided I wanted to be in the Indian Air Force.', 'Choudhary appeared for the Service Selection Board (SSB) examinations in the final year of engineering and got selected. Today, she is a navigator in the transport fleet and flies the A-32 aircraft. In her never ending list of firsts is also the fact that she is the first person from her family to join the defence forces. Her father, Prabhakar Singh Choudhary, 53, was a farmer in Mukundgarh village, in the Nawalgarh tehsil of Jhunjhunu district, before he shifted to the state capital in order to ensure that his three children – two daughters and a son – had access to better education and employment opportunities. The family led a humble existence, living in a modest home, and since her father couldn’t afford expensive private education, the two girls, Nivedita and her younger sister, Deepika, went to the Gandhi Nagar Government Girls’ School.', 'An inspired Deepika, who also completed her engineering from Jaipur, has followed in her sister’s footsteps. She worked with Engineers India Limited for a year before getting commissioned in the Indian Navy in 2011. “Deepika had watched me and was very impressed by the disciplined, safe and respectful environment for girls in the defence forces,” explains her proud older sibling.', 'The next project Choudhary has set for herself is to climb all 14 eight-thousanders – peaks that are more than 8,000 metres high. So far, only two women – 38-year-old Basque Spanish Edurne Pasaban Lizarribar and 41-year-old Austrian Gerlinde Kaltenbrunner – have done this, and it’s no mean task. Pasaban, in fact, completed this feat in May 2010, nine years after she climbed her first 8,000 peak, the Everest.', 'Choudhary isn’t sure if she can summit all 14 peaks as an IAF officer before she retires at 35. But she still has eight years to go and the spirited young woman nurses “high” ambitions.', 'Get the best positive stories straight into your inbox!']"
8,-2013-3-page-3-,"['Archives', 'TBI Inspiring Women: Sunitha Krishnan – Fighting The Scourge Of Human Trafficking']","['In commemoration of International Women’s Day, we are giving away a copy of Aung San Suu Kyi’s biography this week. All you have to do is tell us about a woman who has inspired you, and you could be the lucky winner. (Contest ended on Mar 10, 2013)  Vasudha Rao did more than just tell us about a remarkable woman, she also shared her blogpost with us. Here is her account of Sunitha Krishnan – the anti-trafficking crusader!', 'I was introduced to Prajwala by a friend on the internet. As I read and understood what Dr. Sunitha Krishnan has done and continues to do, I was filled with admiration and respect for her.', 'A victim of gang rape herself, Sunitha Krishnan has risen from the ashes to rescue others from trafficking. The tasks she has on hand are just too enormous. Her organization has been instrumental in rescuing and rehabilitating thousands of women and children.', 'She has a blog titled “Sunitha Krishnan: Anti-Trafficking Crusader” where she recounts her experiences of rescue. Actually, her blog is not an easy read. It is very difficult to read about small girls (as young as four year old) being raped by fathers, uncles, brothers, cousins and neighbours. Her blog posts can just shame us all out of our peaceful existence. The least we can do is spread awareness about the scourge of trafficking.', 'We are a very proud nation, boasting of our glorious past and our current status of being an ‘economic giant’. But we seem to brush under the carpet the sins committed by us. Trafficking is increasing at an alarming rate and no one is spared. Girls are brought in from Nepal and sold to brothels all across our nation. The alarming part is that people who are involved in all this are the ones who are trusted by victims.', 'The condition of the victims is worse than that of slaves! The victims are subjected to the worst form of sexual abuse often accompanied by violence. It leaves the victims emotionally as also physically brutalised. The victims have to keep catering to many clients and end up with HIV/AIDS. Then, they are just discarded as they are now useless and cannot bring in any returns for their owners.', 'Sunitha’s organization ‘Prajwala’ has been rehabilitating the victims after rescuing them. Shelters have been built and a factory has been opened where skills like carpentry, welding, etc. are taught to the girls. Prajwala also tries to unite the victims with their families. Sometimes, the victims are not accepted back by the families owing to the backwardness of our views on women. At such times, Prajwala takes full responsibility of these victims. Some women and girls are also married off by Prajwala in its endeavour to integrate the victims back into society. Prajwala also takes care of the last rites of the victims who pass away. In all these tasks, Prajwala faces stiff opposition from our society.', 'Prajwala works with police and other law enforcement agencies in this job of fighting commercial sexual expolitation. The organization never seeks publicity for the rescue of the girls, letting its work speak for itself.', 'Prajwala and Sunitha have won many awards for their exemplary work. They are now sought after the world over by programs for rescue and rehabilitation of victims of trafficking. Even State governments are listening to Prajwala and Sunitha in effecting measures for the prevention of trafficking. All this will surely help in minimising this crime.', 'Sunitha has said time and again that the silence of the society towards human trafficking has to change. Let us become aware and appreciate Prajwala.', 'One can become a follower by joining Sunitha Krishnan’s blog,\xa0or ‘Like’ Prajwala on facebook to get updates on their work.', 'Also read about Sonali Mukherjee who survived a devastating acid attack to now fight violence against women.', 'Get the best positive stories straight into your inbox!']"
9,-2013-3-page-3-,"['Archives', 'TBI Inspiring Women: Preeti Monga – Loss of Sight Never Means Saying No To Life']","['Being blind can be difficult for anyone to accept. In a country like India, it is sometimes all the more demanding due to societal attitudes and lack of access. Preeti Monga has been visually impaired since age six. Here she recounts, in her own words, the challenges she has had to face and the courage she found to not only overcome them, but also start an organization to help persons with disability. Truly, an inspiring woman.', 'It is more than two decades ago that I first heard people referring to me as a positive person. At that point, I remember, I was feverishly struggling with life and even mustering up a smile was personal torture. Yet, if I could still smile, it was because of my parents.', 'I am 53 today. My visual disability was discovered at the age of about six, after constant complaints about my school work from teachers. I was instantly rushed to our family doctor who diagnosed my approaching blindness. It must have been a shattering experience for my parents but they kept it away from me. The atmosphere at home was normal and brimming with love and happiness. I was singularly free of anxieties and the fear of disaster did not destroy my confidence in any way.', 'Stationed in the remote township of Agartala, the capital of the northeast state of Tripura, and with little access to specialised support, counselling or guidance, my parents had absolutely no idea about how to bring up a blind child. All they did was to rely on their own good sense. For a while, they toyed with the idea of sending me to a school for the blind, but none of the schools they visited satisfied them and they fortunately abandoned that option. Instead, following their instincts, my parents brought me up just as they did before the disability came to mark my life. They taught me everything they needed to, in ways that were innovative and simple. For instance, my mother would close her own eyes and develop effective ways to teach me.', 'I was lucky, therefore, to be among the few disabled people who had a family that did not waste time in finding ways to get me to accept my disability and make the most of the other positives I possessed. It was because of close family members that I could journey through life without having to face segregation and rejection alone.', 'This, of course, does not mean that it was smooth sailing all the way. Challenges became part of my life. The first major setback came when I was thrown out of school at the end of Class VIII on the argument that because I was blind I was a source of disturbance for the other students. My formal education came to a standstill since no other regular school wanted to admit me, despite the best efforts of my parents. Blind schools were the only other option. But because their standards were so low they were not a viable option.', 'Without formal schooling, what were the choices before me? I was sent to learn music since it was said that if one loses one’s sight, one is automatically bestowed with the gift of being musical! For the next eight years I leant the sitar and completed a diploma from the Gandharva Mahavidyalaya. Unfortunately, I never understood music sufficiently and failed completely at it.', 'By this time I had grown up into a young woman with all the dreams that youth brings with it. Like women of my age, I too wanted a good marriage, kids and a reasonably comfortable home. But it seemed the world had other ideas. Because I was blind I had no right, it seems, to hold on to the simple, down-to-earth aspirations of human beings everywhere.', 'That lesson was brought home when the hunt for a husband began. I had a host of men who were friends but no one wanted to marry me. An arranged marriage seemed out of the question. Suitors would arrive and back off the moment they found that I had vision impairment.', 'That was a period of pain and humiliation in my life. Finally, in 1982, I met and married my first husband. But it was a marriage that headed straight for the rocks from the very beginning. By 1986 – I was a mother of two then – I knew I had to do something to get the children and myself out of the mess we were in. But this meant that I had to first become economically independent. With only a Class 10 certificate by way of educational qualifications to my name, it seemed that chances of getting a job were very slim indeed. The only skills I possessed were those of being a good homemaker and a reasonably good typist with some very basic knowledge of music. It took me a whole year to figure out a way to earn for myself. I then struck upon the idea of becoming an Aerobics instructor. Within six months, I had my own classes running smoothly.', 'In 1993, I finally separated from my first husband. The children and I moved back into my parents’ home where I was once again unconditionally supported by my parents as well as brother and sister-in-law. In 1994, I took up a full time job at the National Association for the Blind as a resource person and a computer teacher. From there I moved on to getting a job as a marketing and sales manager with a food marketing company. It was here that I met my second husband. Although he was almost ten years younger to me, I knew he was just the person I was searching for all these years. In the year 2000, I joined Dr Shroff’s Charity Eye Hospital, Daryaganj, as head of public relations and slowly began to get drawn into training, counselling and patient care.', 'Looking back I realise that years of struggle and repeated failures left me with a profound sense of fearlessness. Garnering the strength to hang on, no matter what the situation, was my recipe for success. I felt that the time had now come to share this valuable insight with others and that led me to launch a non-profit called Silver Linings Trust. It sets out to motivate, inspire, train, guide and counsel people with disability in order to empower them to merge with the mainstream and help them lead fulfilled, meaningful lives.', 'The road of life has been long and tortuous one, but finally today I have a sense of peace. I believe I have managed to fulfill my dreams many times over and live life on my own terms.', 'Get the best positive stories straight into your inbox!']"
10,-2013-3-page-3-,"['Archives', 'TBI Giveaway #4: The Lady And The Peacock – The Life of Aung San Suu Kyi of Burma']","['\n\n\nby\n\nAnuradha Parekh\n\n\nMarch 5, 2013, 10:33 am \n\n\n', 'International Women’s Day 2013 is on 8th March. Here at The Better India, we are paying tribute to the indomitable spirit of women in our own special way. Starting with the giveaway of a biography of one of the most remarkable women of our times, to several stories of women with exceptional grit and determination, who are working to bring about a positive change in their communities. Join us as we celebrate the women around us, and thank them for their infinite sacrifices and courage to hold on and make things better.', 'This week, we are giving away a copy of The Lady and the Peacock by Peter Popham – the definitive biography of Aung San Suu Kyi, Burma’s pro-democracy leader. Known and admired the world over for her bravery and commitment to democracy even at a great personal cost, this Nobel Peace Prize winner has epitomized the struggle for freedom and the indomitable spirit of a woman and a leader for 25 years.', 'In spite of being kept under house arrest for 15 years, and not allowed to see her husband who was suffering from cancer and eventually died from it, Suu Kyi kept a calm composure and a positive outlook. Her non-violent methods eventually paid off, as Burma enacted large-scale democratic reforms and held elections last year.', 'The book is an incisive look at Aung San Suu Kyi – the wife, the mother, the daughter, the individual and the democratic leader. And here’s your chance to win a copy for free! In order to participate, all you need to do is tell us of other remarkable women you have come across in India who are similarly working for a positive change. They need not be great political leaders or famous personalities, we would most love to know of the unsung hero(ine) in your neighbourhood who is selflessly helping others in need or improving things around her. We want to know and honour these women who inspire us every single day!', 'You could send in your entries on our Twitter feed or Facebook page. Or just write to us: contact@thebetterindia.com The best entries will be broadcast to all our readers. The contest is on till 10th March 2013. Brought to you in partnership with Random House India.', 'Update on 13th March 2013: \nCongratulations to the winner for this contest, Priya VK Singh, who wrote to us to tell us about the exemplary work done by women she knows. These women will be featured on TBI very soon! A big thank you to everyone who participated and introduced us to so many remarkable women.', 'Get the best positive stories straight into your inbox!']"
