,month,heading,content
3,-2013-3-page-3-,"['Archives', 'TBI Offbeat Travel: Living in a Small Hamlet in Remote Arunachal Pradesh']","['\n\n\nby\n\nYoginder Sikand\n\n\nMarch 22, 2013, 9:46 am \n\n\n', 'Yoginder Sikand takes you on a daring trip to a remote part of the remote state of Arunachal Pradesh. It is not for the faint-hearted or the luxury-seeker. You will not be observing exotic wildlife or grandiose architecture. But if you are a daring adventurer who can rough it, want to experience a unique sense of oneness with nature and have a deep love for primitive cultures and tribal traditions, you will not find a more perfect place than this!', 'It is definitely way off the conventional tourist map. Located in the far eastern corner of Arunachal Pradesh, in the Changlang border, near the trisection of India, Burma and Tibet, Diyun is a large village, the major market-place for dozens of tribal hamlets in the vicinity. That is where I spent two months earlier this year, volunteering as a teacher in a school.', 'Diyun boasts almost nothing of conventional tourist interest. Till recently, almost the entire area, stretching from near the border with Assam till the towering mountains of the Patkai Bum range of the eastern Himalayas that straddle the Burma border, was under dense forest cover. Only a few tribal families lived in the area, in scattered bamboo huts, engaging in fishing, hunting and jhoom—or shifting cultivation. Then, in the 1960s, the area was completely transformed, when thousands of refugees from the Chakma and Hajong tribes, who lived in what was then East Pakistan and is now Bangladesh, fled religious persecution and were settled here by the government. Today, the vast majority of the inhabitants of the ‘Diyun Circle’, as it is called, are Chakmas and Hajongs—who are mostly impoverished small cultivators, fisher folk and craftsmen. In addition to them are small pockets of other, more powerful and prosperous tribes, including the Mishmis, Nagas, Mossangs, Singphos and Khamtis.', 'Because the ‘Diyun Circle’ doesn’t have a long history, it does not have any historical monuments that might attract travelers. It did boast, several decades ago, of dense forests, which abounded with wildlife. Today, however, only small patches of forest remain in the plains, and even in the mountains large stretches of forest have been indiscriminately felled to make way for fields. Selling timber is lucrative business for some, while for others it is a means for sheer survival. Rampant deforestation around Diyun (and, indeed, all over Arunachal Pradesh, which once boasted of being one of the most densely-forested states in India) has meant that there are hardly any wild animals left in the area. Some decades ago, elephants, bears, leopards and tigers were common around Diyun, but with their natural habitat destroyed and large-scale poaching it is rare to spot even the state bird of Arunachal Pradesh – the hornbill – in the area. The only wildlife that I got to see were a couple of giant spiders, a bison, snake and the common white stork.', 'Since there is hardly any wildlife left and no major monuments in the area, it is hardly surprising that few visitors ever pass through Diyun. But for the traveler with an interest in tribal culture, Diyun – and, I suppose, other parts of Arunachal Pradesh, too – is a fascinating place. For the more anthropologically-inclined traveler, for whom travel is not simply about gazing at grand centuries-old palaces and forts but is also a means to witness and understand the living cultures of ‘ordinary’ folk, some days in and around Diyun is sure to be an immensely rewarding experience—as indeed it was for me.', 'Almost every afternoon, over the two months that I was in Diyun, I would walk or cycle through the neighbouring hamlets to witness a way of life that is fast disappearing in the face of the relentless march of ‘modernity’. It was not at all easy traversing through slush-filled pathways or fording streams on foot or finding my way in the jungle, but that was the only way to do it – there are hardly any paved roads in the area and only an occasional bus that connects a few hamlets. Hardly anyone owns a vehicle here and so the only sound one is likely to hear while winding one’s way from one hamlet to the next is that of the wind blowing through clumps of bamboos, of birds chirping in the trees, of frogs croaking in the ponds, and of village kids having fun in the fields.', 'You could spend hours in and around Diyun, as I did, paddling through brooks, watching men smoking pipes made of long shafts of bamboo, women working in the paddy fields and ducks floating in little pools. You could hike to the banks of the enormous Dihing river to see the sun set over the mountains and watch tribal people lay fish traps made of bamboo poles or hunt for insects under the boulders scattered on the river banks. You could observe village youth assemble a hut, with just a couple of bamboos for the frame, straw mats for the walls, wooden poles for the stilts, dried leaves for the roof, and a log of wood with broad slits in the middle for stairs. You could watch old men make delicate cane containers to be used for worship, baskets, cradles and hand-fans. You could witness young women working at their looms, creating exquisite, brightly-hued sarongs and towels. You could join a group of women (it is almost always women, and, particularly, elderly women) walking several miles in search of a stream to fish in, balancing giant bamboo-made fishing baskets on their heads. And not to be missed is the amazing bi-weekly street market, where different tribes, dressed mostly in their traditional brightly-hued costumes, buy and sell local produce – grains and vegetables, hand-woven dresses, and fruits from the jungle which you won’t be able to recognize.', 'Most of the ethnic groups in this area claim to be Buddhists. You could chat with a friendly monk, or simply squat doing nothing – which is what some forms of meditation are all about – in a Buddhist monastery. Almost every village here has a Buddhist temple, and most of these are built in the distinctive Burmese pagoda style. You could even trek into the jungle to spend some time with ‘forest monks’, who live all alone in whatever is left of the forest, meditating through much of the day and coming down to the villages only in the mornings to beg for food. On every full-moon and new-moon day, villagers flock to the monasteries to listen to discourses by the resident monks. You won’t understand a word of it all, of course, but it is an experience not to be missed. You might even be able to attend a Kathin Chivar Dan Puja, when hundreds of women from the Chakma tribe gather in the Buddhist temples to weave robes to offer to the monks.', 'If you are fortunate, as I was on numerous occasions, you might be invited to people’s homes for a meal or a cup of tea, and then you could end up spending hours chatting with your hosts to learn about what life is like for people living in one of the most remote parts of a state which itself is one of the most remote in India. You would learn that the Chakmas and Hajongs, who form the majority in this area and are among the poorest communities in the state, continue to suffer neglect from the authorities, their villages having almost no state-sponsored development schemes. Hardly any of them are employed by the state government. You would learn how ‘development’ and ‘modern education’ have come as a mixed blessing for the tribals, bringing material comforts for some, but at the cost of the rapid destruction of local traditions. You would be shocked to learn about the pervasive and deep-rooted problem of drug addiction in the area and about the immensely deleterious impact of television in the area, with Bollywood heroes replacing tribal elders as models for the youth to emulate.', 'If you feel you’ve had enough of Diyun, you could consider cycling – as I did – some 20 kilometres to the nearby town of Miao, crossing an enormous river, which comes roaring down the Himalayas. There is no bridge here, and so you will have to walk half the way on foot, in almost knee-deep, emerald-blue water, and then cover the rest of the distance in a country boat. There is not much to see in Miao, but there is a small Tibetan refugee settlement that you might find interesting. The town’s other supposed tourist attraction, a little zoo, is in a complete shambles – the assortment of Himalayan bears, porcupines, snakes, slow lorises and monkeys that it boasts of are trapped in miserable little concrete prison – like enclosures that are bereft of any greenery or mud. But the journey to Miao, which takes you through stretches of forest, through Chakma, Naga and Singpho villages, and past several little Buddhist temples, is itself well-worth it.', 'You might like to make a short trip to the Namdapha National Park, which can be approached by road from Miao. Spread over some 2000 square kilometres, it is the largest protected area in the eastern Himalayas. Its habitat ranges from sub-tropical evergreen forests to alpine meadows and perennial snow-capped peaks, and it still boasts, despite illegal poaching in the vicinity, of considerable wildlife. You could also consider a hurried trip in a truck to the Hindu pilgrimage centre at Parasuram Kund, near the Tibetan border, beyond the town of Wakro, home of the Mishmi tribe. The road passes through lush green fields and then dense forests, interspersed with orange plantations, till it reaches the mighty Brahmaputra, which comes noisily tumbling down the mountains.', 'As elsewhere in much of Arunachal Pradesh, there are hardly any facilities for tourists in and around Diyun. It isn’t safe, too, especially after dark, with reports of extortions and kidnappings. And, then, there is the additional problem of underground groups which are active in the area. But for those with a bit of daring, it promises to be – as it was for me – a richly rewarding learning experience.', 'Get the best positive stories straight into your inbox!']"
4,-2013-3-page-3-,"['Archives', 'TBI Videos: Magadh Jal Jamaat Helps Revive 2000-year old Flood Water Harvesting Systems in Gaya, Bihar']","['\n\n\nby\n\nAmita Bhaduri\n\n\nMarch 20, 2013, 10:31 am \n\n\n', 'Magadh Jal Jamaat, a loose network of progressive individuals in Gaya has been successfully able to revive over a dozen abandoned water sources and have instilled in people the need to create, clean up and conserve several lakes and ponds in the region. The problem of water scarcity had been of late afflicting the region, which once had a good system of ponds. But through their efforts, the group has managed to revive the traditional methods of irrigation, which are now more effective than the largest irrigation system in the area. Here we present two videos, created by Magadh Jal Jamaat and sourced from India Water Portal, which explain how they achieved these inspiring results, along with the transcript', 'Magadh is centrally located in the present area of South Bihar. Its southern part is undulated and rocky while the northern part comprises of plains. There are plains ensconced within the undulated areas too where good agriculture has prevailed through the millennia. An elaborate network of ‘ahar pynes’ (traditional water harvesting systems) have provided irrigation to the region, which was able to support the ancient Nalanda University and feed over fifty-two water bodies in the area, which is constantly swarming with pilgrims.', '\n“Apna Pani – Apni Pahal” – A film on Magadh Jal Jamaat’s work on reviving the ahar pyne systems in Gaya, Bihar – Part I', 'The area receives an annual average precipitation of over 1100 mm, most of which falls during the monsoon months from June to September. Drawing upon centuries of experience, people built ‘ahar pyne’ systems, to divert the floodwaters through ‘pynes’ and stored them in ‘ahars’. Ahars are reservoirs with embankments on three sides and are built at the end of drainage lines such as rivulets or artificial works like pynes. Pynes are diversion channels led off from the river for irrigation purposes and for impounding water in the ahars.', 'It is mostly to the credit of these systems that paddy cultivation has been possible in this otherwise relatively low rainfall area, when compared to North Bihar. The system attained its highest development in the district of Gaya.', 'While the state had a role to play in the construction of the systems they were largely managed by the people in a collective mode. Modern development brought in hand pumps for drinking water purposes but very soon the decline of the aquifer led to them going defunct. The ahar pyne embankments got dilapidated, pynes became conduits of waste water and ponds became the new dumping grounds for solid wastes.', 'Rivers became big sewer lines and their beds were encroached for real estate purposes. The lakes meant for pilgrimage too got fouled and their water was no longer of bathing quality. Dug wells that brought up the water with diesel-powered pumps started drying up and the supply of their water for the kharif season crop declined. The land could no longer support the families who lived on it, and this led to widespread migration. People got ever more alienated from community institutions which became weaker. They did not have time for community work such as maintaining ahar pynes, a final blow that rendered the systems defunct.', 'It is against this background that Magadh Jal Jamaat scripted a unique success story when they revived the Saryu talaab in 2006 and later on the Jamune Dasain in Gaya city with the help of Army Service Corps Gaya, Central Reserve Police Force (CRPF), police officials, professors, students, doctors and farmers. The revival of this pond set in motion a surge of constructive forces in the region and soon the effects ping-ponged into the revival of ahar pynes. Around seventeen panchayats benefited from the revival of the 28 km long Chapardha pyne, which carries greater discharge than the Son canal, the main public irrigation system in the area.', '“Apna Pani – Apni Pahal” – A film on Magadh Jal Jamaat’s work on reviving the ahar pyne systems in Gaya, Bihar – Part II', 'Attempts have been made to privatise the traditional irrigation systems during the period 1997-2008 and the Magadh Jal Jamaat has been creating awareness about the consequences of this and the need to successfully restore the systems on a collective basis. While the state has been creating grounds for bringing in new policy and legal framework, the group has formulated a Water Policy for the Magadh region based on wide consultations.', 'Magadh Jal Jamaat came up with a booklet titled “Gaya shahar ki jal vyavastha: Samasya evam samadhan”, (Water Management in the city of Gaya: Problem and Solution) which attempts to deepen the understanding of the city’s physiography, hydro-geology, present status of water availability, its potential and based on these suggests water management measures that should be taken. It notes that the city when compared to places in Punjab and Gujarat is better endowed in terms of water availability but has highly inadequate water storage and distribution mechanism. The crisis according to Ravindra Pathak, Magadh Jal Jamaat is man-made and the problem has been plaguing the city in the drought years of 2006 and 2010.', 'While the State Government had rights over the water, the Bihar Irrigation Act of 1997 delegated the Collector with the authority to engage any agency to repair or construct the water systems whenever it is unable to do so on its own and this is one point which MJJ has utilised. In this locale, where agriculture is increasingly becoming unviable and irrigation costly, MJJ has created a momentum by focusing on smaller barrages on streams and calling for renovation of the system through regular removal of sand through reviving collective means like the traditional system of ‘gomam’ (community labour), which had till some time ago seemed to have been washed away with the top soil.', 'They are actively working in close collaboration with the State Government to facilitate the creation of community based organizations for undertaking large-scale ahar-pyne renovation programme in the area. Ravindra Pathak notes that “so far the group has revived over a dozen abandoned water sources including Saryu talab in Gaya and has created several new ones”. We wish the group many successes, and hope others will join in their efforts or create similar groups in their own communities to fight the looming issue of water scarcity.', 'Get the best positive stories straight into your inbox!']"
5,-2013-3-page-3-,"['A writer describes his meeting with Sudhanshu Biswas, the 99-year-old freedom fighter from West Bengal who runs schools, orphanages and dispensaries for the poor.', 'He is 99, Fought the British, Served the Poor & Has Just Won the Padma Shri!']","['\n\n\nby\n\nSaunak Bhattacharyya\n\n\nMarch 18, 2013, 2:56 pm \n\n\n', 'Saunak Bhattacharyya had an opportunity to meet a nonagenarian freedom fighter who changed his outlook on life and made him think deeply on what it is that makes heroes – ordinary men and women who make extraordinary sacrifices so that others around them can live better. Whether through love for his country or love for his fellow human beings, Sudhanshu Biswas teaches the values of compassion, perseverance and belief in one’s purpose.', '(Update: The 99-year-old freedom fighter from West Bengal has been honoured with the Padma Shri award for the year 2018. His philantrophic organisation runs schools, orphanages and dispensaries for the poor and the downtrodden.).', 'Getting down from a crowded local train at Dakshin Durgapur railway station, I saw dark clouds setting in. I came out of the station and searched for a rickshaw or cycle-van (a popular mode of transport in rural India). Finding none, I began walking through the village roads. I am in a village of South 24 Paragans district, 35 kms from Kolkata. This district and the neighbouring Sunderbans are some of the poorest districts of India. After walking 2kms in the mild rain, I reached ‘Sri Ramakrisha Sevashram’ (SRKS) to meet Mr. Sudhanshu Biswas.', 'Owing to urbanization, old people get deserted by their family. The hermitage provides shelter to 29 senior citizens from the nearby villages. A charitable dispensary is also run as a part SRKS. To top it all, well into his seventies, Mr. Biswas studied general medicine and Homeopathy, observing the irregularities of doctors in villages. He collects medicine samples from physicians and distributes them among the sick.', 'Drying myself with a towel, I inquired why there was no transportation from the station. Mr. Biswas replied with a smile “When there is no demand, there is no supply”! His simple reply, or rather its inverse, also answered my unasked question as to why this 95 year old freedom fighter chose to spend his last four decades here. Instead I asked him what was the main objective of SRKS. ', 'His kindly eyes met mine directly and he said “To impart man-making education”. The depth of conviction came from his own first-hand experience of being arrested from the examination hall by the British police during his childhood; a memory that has driven him since to help educate the less privileged—backed by his understanding of the importance and meaning of education.', 'As the conversation went on I learnt that he had left home while still in his teens to fight for India’s freedom. He successfully carried ‘live bombs’ to lodge an attack on the British Administration. Mr. Biswas dodged death a number of times in gun battles. He was caught by the British and jailed for several years. The simple man before me has been a part of the famous revolutionary group – Anushilan Samity.', 'After independence, enthused by the teachings of Swami Vivekananda – “Service to man is service to God”, Mr. Biswas founded SRKS. No wonder he had chosen this poverty stricken village where I was surprised to see that neither any temple nor mosque existed – an unusual occurrence in India.', 'In the last four decades, he has set up 18 free schools for the poor children in remote villages in the nearby Sunderban area. The teachers of the schools belong to the same village and hence an ownership is created. Till date, thousands of orphans have stayed and studied in SRKS and currently he is bringing up 67 orphan students who study and take care of all the work of SRKS.', 'He sits straight, glows bright while talking about the past with deep eyes revealing his knowledge about ancient religious scriptures. He talks and hears well, as he showed me the ashram which has a pond, small agricultural tracks and fruit trees. Every day he takes Mathematics classes in the school. I truly believe now – “This life is short, the vanities of the world are transient, but they alone live who live for others, the rest are more dead than alive.”', 'I met a person who is superior to me in all aspects. Physique: At 95 he does more physical work than me. Work: A visionary and does more significant work than myself. Sacrifice: I sacrifice little money and few hours for the down-trodden, his entire life is for and among the poor. Love: I married my school mate after 10 years of courtship; he still carries the bullet marks he received due to his love for his own country and billion countrymen. Academics: He still teaches 10th class mathematics, without the help of calculator. Scripture knowledge: I have the holy thread around me and he has the ageless wisdom around himself.', 'A standard eighth student came to close the gate. Seeing the never ending rain and after enquiring that I have no umbrella with me, he thought for a while and opened his cap. His cap was an old free cap from a popular health drink provider. It was as prized for him as our premium branded watch or new i-pod is. He offered his cap and insisted that I wore this, to protect my head from the shower. I was indeed touched by his gestures. Mr. Biswas is right; I was taken aback with the man-making value education infused in these kids. Although it was raining, I saw the dark clouds flying by.', 'You could visit their website for more information on their work, and how you could help them in this. While monetary assistance is needed, even donations in kind are appreciated. Due to the poor access to the place, it is not easy to attract and retain primary teachers and mentors. Also, they are unable to offer very lucrative packages for good teachers to live there. To solve this, we are exploring the feasibility of holding virtual classes. This will be possible if we can manage to get desktops, webcams and internet connectivity.', 'In addition to this, stationery items, groceries, woolen clothes and blankets would be highly appreciated. When I visited them second time, during December it was a pity to see these kids in half pants! They would also highly value individuals who could give them some time and support to help them reach out to more people with their work and sustain themselves with revenue-generating activities. Do contact them or the author at saunak123@gmail.com for further details.', 'Update from the author on 2nd Dec 2013: I visited Sri Ramakrishna Sevashram last month and learnt from the officials there that because of the TBI article on the organization, since March they have got a donation of Rs. 4.9 lacs. This is a significant amount for this rural resource-less NGO. All credits to TBI for providing the platform – you and your team have MADE IT MATTER for them. Half of the donation has been used on water supply and tanks – which is complete now. They plan to start vocational training with the remaining amount. In addition to this, the ashram also received coverage by CNN-IBN after their reporter read the article on TBI – TBI enabled this as well.', 'Get the best positive stories straight into your inbox!']"
6,-2013-3-page-3-,"['Written by Gangadharan Menon', 'TBI Photo Essay: Kuldhara – The Deserted Enigma']","['\n\n\nby\n\nGangadharan Menon\n\n\nMarch 14, 2013, 10:17 am \n\n\n', 'Today, join us as we explore a mysterious ruins, and try to unravel the baffling secret that forced people living for five centuries in 82 villages to just pack up and leave overnight! Enter the world of the unknown at Kuldhara in Rajasthan. Shrouded in enigma, surrounded by myths, believed to be haunted and cursed, this is a place that lights up the darkest recesses of our imagination. A must-see!', 'Gangadharan Menon is a nature writer, art teacher, and photographer of the wild.', 'Get the best positive stories straight into your inbox!']"
