,month,heading,content
0,-2013-3-page-3-,"['Archives', 'TBI THIS-Ability: Testing the Waters in Accessibility Technology']","['Continuing our series on disability and the strides made in this field, we visit the office of one of India’s leading accessibility technology firms, and meet their visually impaired tester Priti Rohra, who decided to break away from the conventional jobs offered to persons with disability in India and try something new!', 'The suburban Mumbai office of Barrier Break Technologies could easily be mistaken for yet another urban start-up. Besides the ‘tech’ factor in their name, their space is filled with young faces who could well be designing gadgets, creating new apps – stuff new India seems to be high on these days. Fact is, Barrier Break is indeed doing the above, though only in the field of disability. And what’s more, as we realize on seeing a young man hobble from one desk to the other, over 70 per cent of the office is disabled. Priti Rohra, Head – Accessibility Testing & Development, is one of them.', 'Taking effortless strides in crisp formals, Rohra leads us to what looks like a meeting-cum-exhibition room. Several gadgets here, of whose functions she explains later, have been tested under her watchful mind. To Rohra, her over eight-year-long stint with Barrier Break, one of India’s few ‘accessibility testing’ and ‘assistive technology’ firms, has been a chosen career path, for she has Retinitis Pigmentosa (RP), a genetic form of blindness since she was three. It didn’t come easy though, she tells us of the stereotypical black hole of vocations that are offered to blind persons in India. “NAB (National Association of the Blind) offered me training to become a telephone operator; there was also that option of taking up handicraft making.”', 'But then this was the turn of the century, and opportunities, unlike certain attitudes, were changing in India. Some networking led Priti to her current employer, which had set up shop in 1995 and has had a disabled-friendly outlook since. “I started as a tester. I’d go through websites, PDFs, play flash games, be a recipient of e-learning solutions,” she reminisces, and much has changed from the beginning of her stint to now, when the technologies are advanced, the advocacy stronger and the accessibility solutions for the crores of disabled persons slightly better, if not vastly. “Ten years ago, there were no announcements at railway stations the way there are today. It makes a huge difference,” she gives an example.', 'Truth be said, we are today interviewing Priti because she was supported by an able family who let her pursue a career of her choice and hone her skills. Or else, the nudges of the system to the blind toward ‘handicraft-making’ and other clichéd vocations continues. “I’ve been a very lucky child. While my parents never raised me with any deferential treatment (Priti has a sighted brother who she looks up as a mentor), they allowed me to be free,” she admits.', 'The result is that the lady is now more than self-sufficient in social settings, and a motivational force at work. Heading a team of two now, Rohra has gained considerable experience in this sector, and speaks with insight. “It’s an untapped market still in our part of the world, and can only flourish with required support from the government,” she talks of products in mobility, learning, visual impairment and other disabilities. She also knows that change must happen from bottom-up, and we guess that she’s hinting at more women like her coming up in the field in the future. Through careful programmes, not luck.', 'The ‘untapped market’ is quite an intriguing phrase, for Barrier Break isn’t another not-for-profit initiative. It is rather a social enterprise, and obviously has to look at its bottom line for sustenance and growth. As we glimpse into the workings of the products in the room as introduced by Rohra, it really feels like a different world from the perspective of an ‘accessibility tester’. There are computer keyboards with huge keys, adapter switches quadriplegics can use to seek attention (versus the classic ‘thread being pulled by teeth to ring bell’ manner), there are magnifiers, scan-and-read devices, gadgets for children and much more. With the current e-commerce boom in the country and a viable climate for entrepreneurs, this might be great news for disabled people.', 'It’s an interesting career stage for Priti, who’s just taken a sabbatical and returned to the same company. “I want to participate globally. There are some business ideas in the IT sector (diagonally different from her family business) I want to carry out with my brother,” she thinks loudly.', 'Well, as long as path-breaking employers keep mushrooming and technologies continue their strides ahead, it’s only an upward curve for the Priti Rohras of India. May there be many more.', 'Get the best positive stories straight into your inbox!']"
1,-2013-3-page-3-,"['As part of our video series #BetterDays, we will be doing a docu-film on Shafiq Khan along with Lara & Patrick from Bem-Te-Vi Producoes. This is our first ever crowd-funded video project and if you wish to make a contribution towards it, click here', 'TBI Heroes: An Amazing Indian Who Aspires To Empower People']","['He has the courage to raise voice against the social evil of bride trafficking, enslaving and exploitation of women. He has the passion to inspire and lead a 300-kilometer ‘March Against Female Foeticide and Gender Inequality’. He has the perseverance to fight all odds because he wants to build an India where women will live with respect and equality. Meet Shafiq ur Rahman Khan, the founder of ‘Empower People’.', 'Even as a teenager, Shafiq Ur Rehman Khan was furiously active and stood upright for the education rights of Dalit children and other excluded communities in Gaya (Bihar). He always wanted to work for those people who were dying of hunger and starvation and for those who were forced to sell their children to traffickers to earn some food.', 'He was recently honoured with the ‘Amazing Indian Award’ by Times Now because he rose above the norms and worked single-mindedly for the cause of rescuing girls who fall victim to “bride trafficking.” He is still as humble and one can see the passion for social welfare in his eyes. We caught up with Shafiq to know more about the mission and the man himself.', 'I, along with my teenage friends, decided to launch an organization to work for the livelihood and education of the Dalits way back in 1999. Within six month, we were able to expand it in 23 blocks of Gaya as well as in Aurangabad, Nawada and Jehanabad of Bihar and Chatra, hazaribagh of Jharkhand. But a group of naxalites was not happy with our social welfare concept and continuous physical attacks made us shift to Delhi. The big city widened my horizons but narrowed down my focus. I realized the menace of human trafficking is one of the worst problems for India. EMPOWER PEOPLE was launched in 2005 in New Delhi as a dedicated participatory campaign against gender inequality. In 2006, our group marched from Jind to Hisar for a social mobilization campaign involving villagers who joined us to fight against female foeticide. Again in 2012, we organized a march against bride trafficking – a typical awareness generation and sensitization programme based on peoples’ participation and interface between Government/NGOs/NPOs officials and vulnerable communities.', 'So what made Shafiq so committed to help all those girls who were deceived in the name of marriage and exploited sexually/physically?', 'Honestly, social welfare has become a style statement these days. People consider it elite to run or be a part of some NGO. I have never believed in any elaborative ideology. Seeing someone suffer in the hands of others, seeing girls getting sold for less than hundred bucks and living the life of slaves, seeing how girl children were killed in womb – all these were good enough a reason for me to focus on the issue of human trafficking and gender inequality.', 'And how does he do that? The whole world should know how Empower People rescues brides who have been the victim of human trafficking.', 'Empower People works on the concept of community participation. We have vigilance committees in many parts of North India who keep us updated whenever they see a girl or woman in trouble. After getting any such cue, the first thing we do is to contact and convince local stakeholders and religious or ethnic leaders to rescue that girl. Simply because, the society itself has to empower the women! After garnering support from local people, our group conducts the rescue operation. We also register an FIR with the local police. Police, generally, are not willing to rescue such girls but they come forward once they notice the local support. The problem does not end with just rescuing; there are very few women shelter homes. Even these few ones are not properly maintained and lack basic amenities. So we make sure that the rescued girl is accepted back in her village or society and is able to live a normal life in her own environs. Community level sensitization workshops and other activities are our engagement tool to carry out all these activities.', 'That indeed sounds great! Shafiq also talked in detail how ignorant poor people fall prey to bride traffickers.', 'Bride traffickers generally target people who can’t marry their daughters due to dowry or other social stigmas. Prosperous states like Andhra Pradesh, Punjab and Kerala are the hub for international bride traffickers and poor states like Assam, Bihar and West Bengal are facing the trouble from domestic bride traffickers. We need to make society aware that if someone is offering an unusual help for marrying your daughter, it is better to say No and report such people to Police. Parents, who are marrying their daughters abroad, should inquire in detail about the boy and his family.', 'Shafiq also elaborated on how an aware society and active youth can uproot this evil.', 'Awareness and promotion of equality is necessary to tackle all the problems. Women empowerment is not different from community empowerment; we believe in community empowerment with a fifty percent leadership participation of women. There are many ways we all can contribute to women empowerment. A simple contribution like changing profile picture of your Facebook profile can help us in making this issue popular. Our group needs volunteers who can write or translate on behalf of us. We need financial support also to carry out some operations. The youth can join our group and contribute directly to building a better nation where our women are not forced to live the life of sex-slaves!', 'The best thing about his group is that it promotes community-based sustainable livelihood once the girls are rescued. Many such survivors have been trained by his group in commercial farming and they are doing very well for themselves now. Shafiq proudly recounted the story of a few brave trafficking survivors who are now a part of his group in combating the problem. Survivors like Ghaushia Khan (rescued by his group); an illiterate woman is now a nominated member of District Legal Aid Authority in her village. Many others like Usha Kumari and Jamiya Mariyam has become the head of village-level units of Empower People.', 'As an inspirational personality, Shafiq stands by his concept of making people the real instrument of change through awareness and participation. He believes in a holistic understanding about the notion of ‘Violence Against Women.’ Rather than working in project-wise schemes or with limited focus, he wishes to address the problem from the very root and plans to have a mass movement and an ideological campaign within the society against female foeticide and gender-based exploitation.', 'We salute his cause and support him through our communication network. To build a progressive nation, it’s time to take a step towards empowering people. Empowerment comes with awareness; so let us all contribute a little by talking about such people and organizations.', 'You could visit Empower People’s website to know more about their work, or like their facebook page!', 'Get the best positive stories straight into your inbox!']"
2,-2013-3-page-3-,"['Archives', 'Baran’s Sahariya Adivasis Reap the Harvest of their Struggle Against Slavery']","['\n\n\nby\n\nAnumeha Yadav\n\n\nMarch 25, 2013, 10:28 am \n\n\n', 'The Sahariya tribe of Baran district in Rajasthan is classified as a Particularly Vulnerable Tribe. For years, they were forced to work as bonded agricultural labourers by the landed gentry of the region. The past decade has seen them fighting for their rights, and now with the help of some local NGOs, governmental support and their own unified efforts, they are slowly reaping the benefits of their struggle to be treated as free and equal citizens of this nation. Anumeha Yadav revisits the tribe to report on how they are faring.', 'For the last two years, Sahariya adivasi families in Baran district on Rajasthan’s border with Madhya Pradesh have waged a powerful struggle against generations of slavery to local landlords. Since November 2010, more than 200 Sahariya families have refused to work as ‘halis’ – bonded agricultural workers – in return for small loans on which landlords charged 40 to 70 percent interest. Last year, The Better India had published an article detailing the freedom struggle of this tribe, and their efforts at re-building their lives. We revisit the tribe a year later in this follow-up report to see how these erstwhile halis are faring with their new-found and hard-fought independence. Last month, 135 Sahariya families in Kishanganj block in Baran district sold the first portion of crop harvested on land they reclaimed from Sikh, Jat, Dhakad landlords.', '“Last July, the former district Collector B Sarvanan held a public hearing for us to register our claims. The district administration then restored 625 bigha land encroached by landlords in Sunda village to 135 Sahariya families. Initially, there was fear that the landlords will retaliate so women from Sunda, Amroli, Kherla, Lakhimpura and Dabka stayed back near the land two months during the rains. We sowed mustard in 400 bigha, and wheat and coriander in the rest,” said Gyarsi Bai Sahariya a community worker with NGO Jagrut Mahila Sangathan (JMS). “The mustard from just 50 bigha fetched us Rs 1.5 lakhs, we may earn upto Rs 20 lakhs from the whole harvest,” she added.', 'Among the most vulnerable families among Baran’s Sahariyas have found a crucial support in finding a new means of livelihood in MNREGA\xa0(The Mahatma Gandhi National Rural Employment Guarantee Act 2005). Since 2011, hundreds of Sahariya tribals families trapped in bonded debt to rich landlords since decades have found employment under MNREGA.', 'Sahariyas are categorized as a Particularly Vulnerable Tribe (PTG), i.e., the most marginalized among tribes. The Sahariyas living in Baran came to national attention in 2000-2001 because of several hunger deaths in the community. The death of 47 Sahariyas because of starvation in the drought in 2001 triggered the Public Interest Litigation in the Supreme Court on right to food. Hunger deaths were reported among Sahariyas in 2004 and again in 2009.', 'In 2010, the NGO Sankalp and Jagrut Mahila Sangathan (JMS) organized a ‘Mazdoor Haq Yatra’ in four blocks in Baran with support from the Soochna evum Rozgaar Adhikar Abhiyaan Rajasthan. The yatra went on for 15 days. Following this, a ‘mazdoor satyagraha’ began in Jaipur on 2 October 2010. At this non-violent protest for minimum wages under MNREGA, the Sahariyas from Baran spoke up about having to work as halis, or bonded labourers, for landlords who had usurped their lands. They narrated how they had had lost their traditional access to tendu leaf, gum, timber as the forest deteriorated and become indebted to Sikh and Jat landowners who charged 40 to 70 percent rates of interest as halis or bonded agricultural labourers on their farms. The Bonded Labour (Abolition) Act 1976 bans hali among 31 forms of bonded debt.', '“I borrowed Rs 4000 and worked without wages on Hansraj Dhakarh’s farm for six years. I worked from 7 am till after sunset. But he would beat me mercilessly if I missed work even one day,” said Om Prakash Sahariya at the Jaipur ‘dharna’ (non-violent protest). Arjun Sahariya said he remained hali all his life and made both his sons work as halis in Khyawada village after borrowing Rs 15,000. Several Sahariya families lived on upper-caste landlords’ farms with restrictions on their movement and in some instances, were dependent on them even for food grains.', 'Following a protracted struggle by the Sahariyas, in 2011 Rajasthan government waived off their bonded debt and entitled Sahariya families to 200 days of work under MNREGA, twice the national norm. Beginning October 2010, more than 250 Sahariya families have found work under MNREGA here.', 'Sahariyas in Sunda village and Eklera village created a ‘credit fund’ of their own, starting by pooling Rs 100 each from their MNREGA wages. In Sunda village in Kishanganj block, there are three such savings groups of Sahariya women, and four savings group started by Sahariya men. In 2012, forty families in Sunda-Chainpura started building a grain-bank with their labour to pool together the foodgrains they got under the Public Distribution System, so that they do not have to rely on landlords for food.', 'The Sahariyas in Baran reached a decisive step in their struggle for self determination when the district administration recognized their claims over land seized from them by landlords. In July 2012, administration re-surveyed and gave possession of 625 bighas of land back to 135 Sahariya families. Using two tractors and seeds provided by the Area Development Committee officials, and fertilizers and fuel provided by Jagrut Mahila Sangathan (JMS), a local NGO, 15 Sahariyas families who had farming experience planted mustard over 400 bighas, wheat over 50 bighas, and coriander on 40 bighas, leaving the remaining land fallow. The remaining households continued to work under MNREGA.', 'Though earlier there were delays and we received MNREGA wages only after three to four months, for the last three months we have been getting their wages within 6-7 weeks and that is a lot of support.', 'said Kishore Sahariya, 35, who worked as hali on landlord Paramveer Singh’s farm in Sunda village since his childhood after his father who was also hali died. Kishore earned no wages and had a bonded debt of Rs 36000 to the landlord but refused to work against debt anymore after he heard about 16 labourers beginning resisting landlords in Eklera village.', 'Last month, the Sahariya families harvested the mustard planted in 50 bighas and earned over Rs 1,50,000 by selling their crop in the agricultural markets. With support from the District Vigilance Committee and JMS, women from all 150 families plan to now set up a cooperative society. Their brave struggle for their freedom, the work they found under MNREGA and their being able to reclaim their rights over land has enabled these adivasi families, among the poorest in the country, to live and work as equal and free citizens.', 'Get the best positive stories straight into your inbox!']"
