,month,heading,content
0,2010-10,"['Written by Chandrika Maheshwari', 'Kilikili: Play Areas for Children with Special Needs']","['\n\n\nby\n\nChandrika Maheshwari\n\n\nOctober 29, 2010, 2:04 pm \n\n\n', 'Rebecca Krook, a play facilitator for kids with disabilities says “When kids play, they remember. They may not be aware they are learning, but they sure are aware they are having fun. When you have a good belly laugh with your siblings or parents or friends, that stays with you. And the great thing is that it comes so naturally…if we only let it.”', ' A Trust formed by the parents of children with special needs, driven by volunteers and supported by professionals, Kilikili aims at creating inclusive play spaces that will be accessible to all children, regardless of their ability which acts as a first step in creating a more inclusive, non-discriminative society.', 'Kilikili wants to create a society where all children, all people are respected for their unique abilities, where diversity is viewed as a social strength. In doing so Kilikili wants to modify the existing play spaces like parks in such a way that they can accommodate children with special needs. They have constructed unique play structures that are completely wheelchair accessible with a ramp, a merry-go-round and a slide along with other equipments such as wheelchair sand tables, safe swings, a sensory integration track, a tyre tunnel and an accessible basketball pole. They plan on creating more such structures throughout the city of Bangalore.', 'In their attempt to be self sustaining, Kilikili offers a range of consultancy services for offices, schools, institutions and play spaces in order to have inclusive play spaces. The various kinds of services comprise of Access Audits and Accessibility Solutions, Designing inclusive play spaces, Designing Play and Recreation Programs for children and Enhancing children’s participation.', 'Kilikili articulates its ideas of play spaces by asking the children with special needs, their peers, sibling, parents, teachers and other professionals what they think needs to go into the design of these play spaces. The design team then conducts a visit to the potential site and then works on converting the plan into action. Kilikili works with BBMP, the local Municipal Corporation of Bangalore to develop these play spaces. Kilikili also organizes school programs and other event like Family Day.\xa0 It organizes an Integration and Inclusion event that reaches out to children from special and regular schools. This aims at helping the children of all abilities learn to interact with each other.', 'The impact of an organization like Kilikili is not quantifiable. It can only be measured by the interest people take in it. Kilikili is a completely volunteer driven organization. It provides people with an opportunity to contribute to the society in a unique way. The parents of kids with special needs are also equally excited about the initiative. The children with special needs, who experience a direct impact, have different stories to tell.', 'To read the stories and know more about Kilikili, visit www.kilikili.org\n\n\n\nFrom TBI Shop\n\n\n\n', ""Chandrika is a student in her 4th year of engineering at BITS, Pilani. She feels that being a part of the Tata Jagriti Yatra'09 will prove to be one of the defining moments of her life. She is currently working with the Indian Youth Climate Network. Her interests include traveling, reading and writing."", 'Get the best positive stories straight into your inbox!']"
1,2010-10,"['Written by Unnati Narang', 'PYDS: A Social Revolution in the Himalayan Foothills']","['\n\n\nby\n\nUnnati Narang\n\n\nOctober 27, 2010, 7:34 am \n\n\n', 'Purkal is a small village in the foothills of the gigantic Himalayas, on the outskirts of Dehradun. Even as the surrounding regions develop, Purkal’s inhabitants, a mere 5000, largely remain dependent on activities such as farming. Families rely on a low, single income in most cases and are unable to break free from this vicious cycle. Children do not have access to quality education, good role models and enough exposure. This is precisely what made Mr. G K Swamy and his wife Chinni step in, by establishing the Purkal Youth Development Society in this peaceful hamlet back in 1998. What was once a small organisation to help children with their studies is now a fulltime school, with the vision of overall wellbeing of the children.', 'It all started when Mrs and Mr. Swamy came to Purkal.\xa0 Mrs Swamy explains, “We left Mumbai to come here because in those days Swamy’s travels would take him away from home for almost 20-25 days in a month. He had become diabetic. There was too much stress in our life. We wondered whether going out to earn all the money to finally spend it was even worth it. Wouldn’t it instead be better to earn less or not earn at all, but to spend a simple and quiet life?” Adding to this, Mr. Swamy explains, “We began our life in a very interesting manner. We decided we’d not have a phone, a car or anything beyond our essentials. We’d never have any servants, we’d do as sufficiently as possible but now we do have everything we didn’t originally want to have and have been supported in our vision beyond words.”', 'Coming to Purkal was never a conscious decision. It was a series of incidents. Even today, the couple feels that they were led to Purkal. Initially, they were living in a rented place, not very far from Purkal. There, they decided to start helping children in education. Mr. Swamy explains, “We wanted to help children learn better and started teaching a few children in our house. I taught the first batch. The next year, when we had another batch, my wife cooked and fed the children, and also taught the new batch.”', 'If it is destined, one thing leads to another. So was the case with this couple, driven to serve a larger cause. Mr Swamy humbly adds, “I don’t know whether we thought of this as our life’s work or our mission. We did think that we’d invest our best into the few children we had in the early stages. The few became many, not at my instance, but because many people thought that it was a good input that the few were getting. I remember in the first few months, a huge delegation of ten women whose children we were not teaching came to request us to take them in and help them improve. I couldn’t say no. It was only later that I realised that we didn’t have enough tables and chairs for the students! I remember looking around for some money and it is then that the first 4000 rupees offer came in, for the furniture!”', 'Today, PYDS has two important missions – to enhance the lives of disadvantaged rural youth through education and to empower women through skill development. The\xa0Yuva Shakti Programme (Youth Power) aims to provide holistic support to children and youth by providing access to quality education, mentoring and attention to nutrition and healthcare. In January 2008, Yuva Shakti began a new education scheme called ‘Bus Them to Purkal’. The programme takes very poor children from remote villages with no access to basic education, and literally buses them to Purkal to join the learning centre.', 'The\xa0Stree-Shakti Programme (Women Power) helps to create economic stability for women and to empower rural women by providing skill training and workspace to produce handmade home and fashion products. Poonam, a beneficiary has been working for Stree-Shakti for 5 years. She lives in the village of Ganesh Puri with her in-laws. Poonam’s sons 13 years old Aman and 11 years old Ankur, both study at PYDS. Her husband owns a small tea shop on the Mussoorie road. How has stree-shakti helped? Her in-laws explain, “We are a family of farmers. In old days, there was a lot of respect and money in farming but now times have changed. We are not able to produce enough even for the family. Since Poonam has started working, we are less worried. The problem is solved. If her children need anything, earlier we’d have to find a way to give them now she can take care of them.”', 'With the support of PYDS, many students have been able to complete their education and have even been provided scholarship assistance. Their mothers too, have been trained in skills such as handloom work. Given the highly integrated model and the humble spirit of service, the impact is bound to be spectacular!', 'The Purkal Youth Development Society\nPurkal Village\nP.O: Bhagwantpur\nDehradun – 248009\nUttrakhand (India)', 'Short film: http://www.purkal.org/pics.html\n\n\n\nFrom TBI Shop\n\n\n\n', ""Co-Founder of Serene Woods portal for authors and photographers, I have authored two books - 'Drenched Soul' (poetry) and 'If At All' (fiction). I am a freelance journalist for Times Ascent and enjoy blogging in my free time."", 'Get the best positive stories straight into your inbox!']"
2,2010-10,"['Written by Rahul Anand', 'Akanksha: Belief In Every Child’s Potential']","['Taqueer had severe health problems in his tenth standard and managed to get only 51%. His father is a tailor in the local community while his mother is a housemaid. After enrolling in the learn to lead programme of Akansha, he enrolled in the Arts department of Wilson college and got the highest marks in history in the eleventh standard.', 'Akanksha is a non profit foundation with a vision to equip students with the education and skills they need to lead empowered lives. Over the past twenty years, the organisation has expanded from 15 children in one centre to over 3500 children in 58 centres and 6 schools.\n\nAkanksha has programmes like the Social Leadership programme, where students work with an organisation addressing a particular social issue. The Learn to Lead programme hones leadership skills in motivated students through workshops, retreats and research projects.', 'They have developed a curriculum that uses innovative teaching methodology to teach English, Math and moral values. The Akansha curriculum supplements gaps in the formal school system and makes learning fun by teaching through games, stories and fun activities.', 'Here is an interview with Chitra Pandit of Akanksha :', 'Shaheen Mistri started the Akanksha Foundation in 1991. When she was 18 years old she visited her grandparents who were in Bombay, and on that particular visit of hers, she saw the inequality in education between the private and the public schools', 'The simple idea then, was to bring the three together – kids, volunteers and spaces. Once we made this three-way connection the first Akanksha centre was born.', 'The biggest hurdle was to get the kids out of their community & come to the centre.\nParents in the communities needed to be convinced about our mission.', 'Getting donors and funders to believe in us was a challenge. But over the years we are happy to share that today the organization serves 3,500 children in 58 after-school centres and six of its own schools.', 'In India today, 13 million children don’t go to school. Of the children who do, 50% drop out before grade five, & only 30% successfully complete grade ten.', 'In the existing schools, 25% of teachers do not show up to work. Only half of those who show up actually teach. If we are able to improve the quality of teachers & improve the quality of teaching we would only then be on the road to progress.', 'MCGM and PMC acknowledge the insufficient supply of English-medium schools and are looking for effective PPP models…', 'The School Project is an initiative that seeks to build a small cluster of high performing municipal schools that redefines what is possible for children from some of the poorest slum communities in Pune and Mumbai, and has the potential for wider systemic reform. These schools are a partnership with the Pune Municipal Corporation (PMC)', 'The mission of The School Project is to build a network of high-performing municipal schools that redefine what is possible for children from some of the poorest slum communities in Pune and Mumbai, and have the potential for wider systemic reform. ', 'Our dream: To grow The School Project to 15 schools across Mumbai and Pune by 2012.', 'Currently there are no plans to move to other states. The aim is to strengthen our network in Mumbai & Pune.', 'To know more about Akanksha, visit their website: http://www.akanksha.org/\n\n\n\nFrom TBI Shop\n\n\n\n', 'Writer, Researcher interested in social enterprise, innovation, culture and networks. Co-Founder @BloodAid. Twitter @RahulAnand.', 'Get the best positive stories straight into your inbox!']"
3,2010-10,"['Archives', 'Haathi Chaap: Elephant Poo Paper']","['\n\n\nby\n\nAnuradha Parekh\n\n\nOctober 21, 2010, 7:46 am \n\n\n', 'That’s right. We are talking about paper made from elephant dung! The brainchild of retailer Mahima Mehra and Jaipur-based handmade paper producer, Vijendra Shekhawat, this pooper, christened “Haathi Chaap” meaning “Elephant Print” is creating quite an impact in Indian and international markets.', 'The thought of creating paper from elephant poo first came to the innovative duo while on a trip up the Amber Fort in Jaipur. More than a hundred pachyderms help tourists make the climb each day, inevitably leaving a lot of roughage along the way that would be of little interest to anybody other than people with curious ideas of paper-making in their heads.', '“There was dry elephant dung underfoot, and suddenly, it struck us how similar it looked to the raw fibre from which we made paper” recalls Mahima. Elephants apparently have a bad digestive system, which makes their dung highly fibrous, resulting in good quality paper. After a year of experimentation of various sorts, pooper was ready for dispatch.', 'The process of making elephant poo paper is similar to that of making any other handmade paper, with the additional challenge of disinfecting the dung thoroughly. The process is explained below:', 'No it is not merely paper that elephant poo has been put to good use for. Mahima has created various other useful and innovative products using the same smelly raw material like bags, notebooks, stationery, coasters and many more. Rest assured, the final product is stink-free. They are based in Delhi and cater not only to requirements from India but Germany and UK as well!', 'For further information on the process of getting elephant poo paper or for checking out their product catalog please visit their website: http://elephantpoopaper.com/', 'Get the best positive stories straight into your inbox!']"
4,2010-10,"['Archives', 'Event: Sociopreneurship India 2010']","['\n\n\nby\n\nDhimant Parekh\n\n\nOctober 20, 2010, 7:44 am \n\n\n', 'Sociopreneurship India 2010 is an initiative by YourStory.in and CNBC-TV18 Young Turks. This initiative’s mission is “To recognise and showcase Social Innovations and Entrepreneurs behind it in a forum that brings Social Investors, Industry Experts and the Media together.”', 'In the recent past, there have been numerous entrepreneurs working on social innovations which impact the rural poor and at the same time create financial opportunities for all. (In fact we at The Better India have featured quite a few such innovations and entrepreneurs).', 'Sociopreneurship India 2010 as a platform aims to bring these entrepreneurs and their social innovations together and recognize their efforts. To put it in their own words, “[This] initiative aims to bring sociopreneurs to limelight so that they are bestowed with opportunities of funding, branding, networking, and making their presence felt, if not known.”', 'The event is going to be held in Bangalore on November 23rd at the Royal Orchid Hotel and will host a very distinguished panel of speakers.', 'If you want to know more about the event, get in touch with YourStory.in here.', 'We here at The Better India are pleased to be one of the media partners of the event. If you are going to be attending this event, do drop us an e-mail and we would be glad to meet up to know more about your social innovations/ideas.\n\n\n\nFrom TBI Shop\n\n\n\n', 'Get the best positive stories straight into your inbox!']"
5,2010-10,"['Written by Unnati Narang', 'Raghurajpur: India’s Cultural Hub']","['\n\n\nby\n\nUnnati Narang\n\n\nOctober 18, 2010, 2:39 pm \n\n\n', 'Raghurajpur, a small village in Puri district, Orissa is known for its heritage. Inhabited by artisans producing sheer poetry on pieces of treated cloth, dried palm leaf or paper, Raghurajpur has nurtured age old traditional paintings, dance forms and handicraft items including patta paintings, palm leaf engravings, stone carvings, papier mache toys and masks, wood carvings, wooden toys, cowdung toys and tusser paintings.', 'Situated on the southern bank of river Bhargavi and surrounded by coconut, palm, mango, jackfruit groves and other tropical trees, Raghurajpur has an idyllic setting. Creativity, in the village, flows in abundance and skills manifest into an emotional realisation of art.', 'The ground level entrepreneurs are closely coordinated by an NGO Parampara, which has structured the inhabitants into 38 groups of 12 to 15 member artisans each, providing them requisite training courses of varying durations from 15 days to 6 months. Wages paid are in the range of Rs 2000 to Rs 5000.', 'Raghurajpur is known for its special type of paintings called the Patta Chitra. This is a traditional Indian painting form, which is done on cloth. The cloth is first coated with a unique mixture of chalk and gum and left to dry. It is thereafter polished before the actual painting work can begin. The painted cloth, known as ‘patta’ is used as a backdrop to the idol of the deities. Pattas are now used as wall hangings.', 'In Raghurajpur, there are close to fifty families of patta painters. The chitrakars also make unique, circular playing cards known as ganjifa which are popular in villages all over Orissa. Usually, the lane in which these painters or chitrakaras live is called Chitrakar Sahi. INTACH selected this village to revive the ancient wall paintings of Orissa. The walls of the thatched houses are painted with colourful murals.', 'Besides producing these beautiful works of art, this village has a living tradition of performing art known as Gotipua, the earlier form of Odissi. A worthy son of Orissa, Guru Kelu Charan Mohapatra, an exponent of Odissi dance, was born in this village and had his early trainings in Gotipua tradition here. Now a Gotipua Gurukul, namely Dasabhuja Gotipua Odishi Nrutya Parisad (Dance School) has been established here under the guidance of Guru Maguni Charan Das. (Visit http://www.gotipuadance.org/index.htm for details)', 'This voluntary institution is situated at Raghurajpur village in residence of Guru Maguni Das. Under the Guru’s tutelage and guidance the parisad has been working for the promotion and popularisation of the unique traditional Gotipua dance for over 30 years. It has already trained 100 Gotipua dancers who have become Odhishi dancers, Gotipua dance Gurus, instructors, etc. in their later life. Gotipuas are young boys of tender age who dress up as girls, sing vaisnab devotional love songs of Radha Krishna and perform Gotipua dance. This institution also provides the boys with formal schooling up to class X. The boys stay with the Guru at his residence for at least six years and complete the course of training.', 'The dance group of the parisad has performed in almost all big and important folk dance festivals of India and attended workshops abroad. Guru Maguni Das, about 85 years old, is still active in imparting training to the new Gotipua trainees and in keeping the traditions alive and vibrant.', 'The community of artisans at Ragurajpur has dedicated many generations to art, standing up to hostile challenges, as they tread the path of a cultural entrepreneurship, unique to their community.', '(Photos taken from Dhriiti, a Delhi-based NGO)\n\n\n\nFrom TBI Shop\n\n\n\n', ""Co-Founder of Serene Woods portal for authors and photographers, I have authored two books - 'Drenched Soul' (poetry) and 'If At All' (fiction). I am a freelance journalist for Times Ascent and enjoy blogging in my free time."", 'Get the best positive stories straight into your inbox!']"
6,2010-10,"['Written by Unnati Narang', 'Smile Foundation: Underprivileged Youth at CWG']","['\n\n\nby\n\nUnnati Narang\n\n\nOctober 12, 2010, 7:13 am \n\n\n', 'The ongoing Commonwealth Games, one of the biggest sporting events hosted by India have been criticised and condemned in news for all the wrong reasons. Finally, as the games proceed smoothly with an impeccable opening ceremony, India has left the entire world awestruck and appreciative of its cultural marvels. Then again, many ‘clean-up’ drives in Delhi in the days that led up to the CWG have led to the poor being displaced. Recognizing that the underprivileged too have a share in this ‘common wealth’ of our nation, Smile Foundation has given the economically backward youth an equal opportunity to share the CWG mania.', 'On the fifth day of the games, the under-privileged youth from the capital city were united to witness the mega event. Smile Foundation beneficiaries were given the perfect platform to be a part of this most awaited sports event. Overcoming the stark disparities of our social structures, the move has helped young Smile beneficiaries to share the excitement of the nation in its true spirit. Santanu Mishra, Executive Trustee, Smile Foundation comments, “It’s a great opportunity for the under privileged community to be a part of this mega event. This gesture has given them a platform to be a part of the greatest celebration of sports in India ever. It will be an unforgettable experience for the underprivileged community which they will cherish for life.”', 'What has made this possible? Support from the Organizing Committee played the key role. Mishra further added, “It’s a great gesture by the Organizing Committee to give the under privileged community a chance to experience this mega event.”', 'Smile Foundation is a national level development organisation reaching out to more than 100,000 underprivileged children and youth across 22 states of India through more than 130 welfare projects on subjects like education, healthcare, livelihood, women empowerment, and advocacy. Smile Foundation promotes and catalyses universal education among underprivileged children, thereby creating a process to embrace these children into mainstream in a sustained manner, thus facilitating them to emerge as productive assets, and set the foundation for nation building.', 'Smile Foundation formed in 2002 by a group of corporate professionals who, decided to finance, handhold and support genuine grassroots’ initiatives targeted at providing education and health to underprivileged children. As a Social Venture, Smile Foundation promotes and catalyses universal education among underprivileged children, create the process to embrace these children into mainstream in a sustained manner, facilitate them to emerge as productive assets, and set the foundation for nation building.', 'Among many campaigns, Smile Foundation’s ‘Beti Bhi Apni Hai’ campaign has been very active especially in light of the Girl Child Day on September 24. It was initiated by Smile Foundation under its programme ‘Swabhiman’ in the year 2009 on the occasion of World Population Day. Recently, the campaign celebrated its second year with an opinion poll on early marriage organized at Shipra Mall, Ghaziabad. The call was ‘let the Girl Child be counted’. More than 200 people were sensitized against early marriage for girls. It was surprising that some of the most educated people wanted their daughters to get married by the age of 18 either due societal pressures or fear of mishap like rape, abuse, etc. Awareness drives and campaigns such as these can go a long way in truly educating the nation and making a difference in the way people perceive social problems.', 'For more details, visit http://www.smilefoundationindia.org', 'Or email info[at]smilefoundationindia[dot]org\n\n\n\nFrom TBI Shop\n\n\n\n', ""Co-Founder of Serene Woods portal for authors and photographers, I have authored two books - 'Drenched Soul' (poetry) and 'If At All' (fiction). I am a freelance journalist for Times Ascent and enjoy blogging in my free time."", 'Get the best positive stories straight into your inbox!']"
