,month,heading,content
0,2010-8,"['Watch this video to know about Door Step School', 'Door Step School: Education now goes to every doorstep']","['\n\n\nby\n\nGuest Reporter\n\n\nAugust 26, 2010, 2:10 pm \n\n\n', 'India is a developing country with a developing population, developing economy, developing education. But is education really developing amongst the people who are born poor and underprivileged. Door Step School has taken the big leap to change the present and to make 100 percent literacy a reality. This is a group of people whose main motivation in life is ‘service to society’ and they believe the best way to do so is to usher in a wave of knowledge that engulfs the future of our nation – the children. Meet Mrs. Rajani Paranjpe, the founder member, who says “We go where ever the children are and start the class right there”.', 'This inspiring lady, whose mission in life is spreading primary education, has closed many prisons as the saying by Victor Hugo goes “He who opens a school door, closes a prison”. When approached by The Better India for a brief glimpse into their world and how they work, she was kind enough to answer all our questions. Below is a detailed interview with Mrs. Rajani about her fantastic initiative, Door Step School:', 'Hundred percent literacy through total school enrollment and quality education for all.\nWe bridge in the gaps in government’s efforts in achieving these goals. Our public education system faces three major problems in this regard, namely, non-enrollment, wastage (dropping out of school at early stage) and stagnation (not achieving the expected level of learning at respective stages in school). All our programs are designed to address these problems.', 'I am a Social Worker by profession. I took this path because I always liked to work for and with people. So after nearly 15 years of my graduation (and infact 15 years of married life!) I took up a course in social work and after a few years of working in the field I joined the College of Social Work Nirmala Niketan, Mumbai, University of Bombay, as a member of faculty. I used to teach Research Methodology and Indian Social problems.', 'I selected Primary education as the mission of my life because I felt:', 'I made a plan to start four programs through Door step School. They are literacy classes (literacy is defined as being able to read a newspaper), study classes, pre-primary education and community libraries.', 'After having a clear idea of what I wanted to do, I shared it with like minded people one of whom was Ms. Bina SethLashkari, a student of mine for two years. She and a few others from the college joined hands with me and we founded the organization in 1988-89 in Mumbai.', 'We named our organization ‘Door Step School” because we go where ever the children are and start the classes right there. E.g. we held classes on pavements or on road construction sites, building construction sites outside big markets, railway stations etc. We have added a few more programs along the way but the core programs have remained the same.', 'We did not face many major challenges as such. I think the following factors helped us in our smooth functioning:', 'However, after we started working with the children of construction workers, we faced the challenge of tracking them when they moved from one site to another. Our search for an effective solution to this problem is still on.', 'As I have mentioned earlier, all our programs are designed to address three major problems of our public education system. The target group is 3-14 (although we cater to children upto 18).\nPre-primary education serves two purposes – it prepares the child and the parents for schooling. On a more practical note it gives us the idea about which children are ready for school admission at the beginning of the next academic year. This ensures near-complete and timely enrollment.', 'For admitting children to school a birth or age certificate is required which many of the parents we deal with do not possess. We help them to get the age certificates and enroll children in school.', 'We provide school transport so that children attend school regularly which helps preventing school dropout and stagnation.', 'Study support classes to children attending school helps improve the quality of education which in turn reduces the chances of dropping out of school prematurely.', 'NFE (Non–Formal Education) classes helping reduce illiteracy.', 'School on Wheels, a bus which is designed as a class room helps us to take classes for children who are on streets and there is no place to gather them and teach them. It helps to cover those who would otherwise remain untouched.', 'School and Community Libraries as well as Reading Classes based in schools help in improving reading ability which is basic to any educational achievement', 'It is difficult to answer this question because the work we are doing is very small as compared to the need for such programs. Therefore I would rather not claim anything on the scale of society or nation.', 'However in the lives of children whom we have touched we have definitely made some impact or the other although this impact is not perceptible or measurable always. Some of our children have completed education and doing well in life. Some have left education midway and continued with their lives. It is their children who will benefit from the exposure we have given to their parents.\nWe experience this and we have many examples to show that a child who was with us even for a short time has nurtured a dream of sending his/her children to school and acts upon it when the time comes. We see this change in the attitude of ‘parents’ as our major gain. It shows that the root of education has struck in the family and now we do not have to worry. It will spread, we hope.', 'To know more about Door Step School, visit their website here: www.DoorStepSchool.org', 'Get the best positive stories straight into your inbox!']"
1,2010-8,"['Written by Rahul Anand', 'Magic Bus: Sports For Development']","['For most of us learning means sitting in classrooms and cramming formulas, theories or maybe\xa0(if I stretch it) reading and discussing with the teachers. With the current structure of dispersal of education, the outdoors seem to be long-forgotten!', 'Mathew Spacie understood the importance of outdoors in learning. Once whilst practicing rugby with friends he met some boys from the slum in Fashion Street in South Mumbai and invited them to join his group. Within 6 months a rugby team was formed and within a year the team started competing in national tournaments.', 'It soon became clear to him that taking a child away from the squalor of his/her immediate environment to a mountain or a sports pitch meant creating a learning environment unparalleled in the child’s life. It was the thought of a ‘vehicle’ picking children up and taking them on a fantastic journey that gave birth to the name Magic Bus. For the children, the journey represented a new adventure to somewhere that was safe and packed with a lot of fun.', 'The core principle of Magic Bus is Sports\xa0For Development. India has the youngest population in the world and it is the youth who are critical for the development of communities. Sport is something that is close to young peoples’ hearts and through its inherent attributes of active participation, energy, empowerment and social inclusion it provides an ideal platform for working with youth and helping them recognize their power and potential.', 'Magic Bus is working as a technical advisory to a UNICEF program along with the UK sport and Indian ministry for Youth Affairs and Sport to take sport for development to communities across India in a project known as ‘ International Inspiration’.', 'Magic Bus also works with communities like Dharavi and slums in Mankhurd and Colaba, where the project\xa0 is headed by two local community coordinators. These coordinators are primarily responsible for sensitizing the community about sport-for-development and Magic Bus, bringing the children to sessions and further mobilizing community support.', 'The organization is working with NGOs in Mumbai who are child focused, supporting them to achieve their -objectives with children by integrating those objectives into the sports-for development framework. Magic Bus is also working with juvenile delinquents providing them the much needed space to express themselves and channelize their energies into more creative pursuits.', 'In Partnership with UNICEF , Magic Bus is implementation a training for trainers programme where they train primary education teachers in Sports for development.', 'Interested to know more about Magic Bus? Visit their website at http://www.magicbusindia.org/.\nThere is just so much happening out there!\n\n\n\nFrom TBI Shop\n\n\n\n', 'Writer, Researcher interested in social enterprise, innovation, culture and networks. Co-Founder @BloodAid. Twitter @RahulAnand.', 'Get the best positive stories straight into your inbox!']"
2,2010-8,"['Written by Unnati Narang', 'Masoom – Illuminating the Night Schools of Mumbai']","['\n\n\nby\n\nUnnati Narang\n\n\nAugust 20, 2010, 1:23 am \n\n\n', '\nTwenty one year old Amol Pashilkar attempted his SSC examination in the year 2004-05. Unfortunately, he could not clear his examinations; he passed only in English. Since his confidence levels suffered a blow, he found it very difficult to reappear. After a four year long gap, in 2009, he took admission in Milind Night High School. With his renewed focus, could he clear the examinations?', 'Amol got 74% in his SSC. How did this drastic improvement come about? Amol could leap forward in academics because of the extra classes conducted by a Maharashtra based social organization that goes by the name Masoom. Masoom works with night schools in Mumbai, with the aim of improving academic performance of night school students.', 'Masoom is the first organization in Maharashtra to run a comprehensive intervention program for night schools. Masoom offers a unique approach to planning and implementing a comprehensive program for night schools based on their different needs. Masoom’s strategy for sustainable change is to work in the spirit of partnership with all major stakeholders in the education system. Because of Masoom, many like Amol could complete their education. Their interest in studies increases tremendously.', 'Nikita Ketkar, the founder of Masoom, stumbled upon the idea of helping night schools back in 2001. She was working in the civil services and was appointed on a project to identify child domestic workers, in the night school of Mumbai. Nikita adds, “I came across students who were largely self-motivated. They worked during the day and would attend classes in the evening. Nobody was forcing them to school. They came because they wanted to learn. It was sad to see that justice wasn’t being delivered to their aspirations.”', 'In 2006, Nikita further undertook research related to problems faced by night school students, under the Pukar Scholarship. Based on the findings, she decided to do something about these issues. She resigned from office and founded Masoom in 2008, her entire research team by her side. To facilitate learning for night school students, Masoom has developed a three pronged approach:', '1. Providing Infrastructure such as computers, Science laboratory apparatus, mathematic kits, library books, notebooks, educational charts, workbooks and worksheets, teacher training material, Braille textbooks and audio-visual material', '2. Capacity Building by organizing training sessions and workshops for teachers, parents and students, vocational guidance for students, counseling, extra curricular classes such as Life skills, yoga, meditation', '3. Advocacy: Masoom works closely with all stakeholders and intend to act as an advocate for all issues concerning night schools', 'Since night schools are run from 6:30 to 9:30 in the evening, most of these kids come after long hours of work. By providing meals, Masoom ensures that they can study more efficiently. Nikita adds, “We want to build not just academic strength but also employability. Many students who earlier had to study with an empty stomach could not focus. Now we provide meals. The kids call it ‘nashta’ as sometimes it is the only meal they have in the day.”', 'In its own unique way, Masoom has touched the lives of many students, growing from just two schools to now ten. There are courses called the ‘bridge courses’ that help drop outs overcome gaps and at the same time, there is facility of psycho counseling for students with learning disabilities. They also help link students to government certified computer courses, for which they have initiated scholarships for part funding. With such personal care and concern for holistic development, there are bound to be many many success stories like Amol’s.', 'Visit Masoom’s website here: http://masoomforu.org/\n\n\n\nFrom TBI Shop\n\n\n\n', ""Co-Founder of Serene Woods portal for authors and photographers, I have authored two books - 'Drenched Soul' (poetry) and 'If At All' (fiction). I am a freelance journalist for Times Ascent and enjoy blogging in my free time."", 'Get the best positive stories straight into your inbox!']"
3,2010-8,"['Written by Chandrika Maheshwari', 'Jagori: Awakening Women']","['\n\n\nby\n\nChandrika Maheshwari\n\n\nAugust 18, 2010, 12:25 am \n\n\n', 'Established in the year 1984 in Delhi as an unregistered society, with a vision of “spreading feminist consciousness for the creation of a just society”, Jagori has been working unremittingly on its mission for over 25 years now. At the time of its genesis, Jagori described itself as “Women’s Resource and Training Centre”. For its founders, a group of seven people – Abha, Gouri, Jogi, Kamla, Manjari, Runu and Sheba – Jagori was their response to a need within women’s movement. They decided to form what they envisioned as a ‘creative space’ for women to express their realities, “to articulate their experience of oppression, to know more about it and to find ways of fighting it.”', 'Over the years, Jagori became a part of various defining campaigns and struggles. Among the issues raised by Jagori in the women’s movement have been those of single women, sexuality, mental health of women, safe travel for women in the railways, and consistent advocacy on violence against women. Jagori has also played a significant role as a member of the National Coordination Committee for conceptualization and coordination of the biannual National Conference of Women’s Movement in India. Jagori has also regularly engaged with the Indian Association of Women’s Studies (IAWS) and housed the Secretariat in 1995.', 'Over the years, Jagori’s objectives have been reshaped into consciousness raising and awareness building on violence, health, education, development and other issues critical for women’s individual and collective empowerment, production and distribution of creative material on feminist issues, dissemination of information and knowledge on feminist concern to meet the needs of women’s groups, NGO’s and development organizations and advocacy on women’s rights and gender equality.\n\nAt Jagori’s Resource Centre, one would find a library with a comprehensive collection of resources on various women’s issues. As a part of regular services, Jagori carries out information search and retrieval for both internal and external users. Specialized services like preparation of reading lists, information packages, topic-based bibliographies, are provided on request. Jagori also provides consultation services to smaller centers or NGOs for setting up libraries or information centers or similar assistance. Jagori also has a distribution and sale outlet for its publications and publications from women’s groups and feminist publishing houses from all over the country.', 'Among the most recent campaigns started by Jagori is the SafeDelhi campaign started to fight the problem of sexual harassment in Delhi.', 'To find out more about JAGORI, log onto www.jagori.org\n\n\n\nFrom TBI Shop\n\n\n\n', ""Chandrika is a student in her 4th year of engineering at BITS, Pilani. She feels that being a part of the Tata Jagriti Yatra'09 will prove to be one of the defining moments of her life. She is currently working with the Indian Youth Climate Network. Her interests include traveling, reading and writing."", 'Get the best positive stories straight into your inbox!']"
4,2010-8,"['Written by Unnati Narang', 'Zainub Exports: Keeping India’s glory untarnished']","['\n\n\nby\n\nUnnati Narang\n\n\nAugust 13, 2010, 3:20 pm \n\n\n', 'In the book ‘What India can Teach us’, Max Muller defines two very different Indias – one is the India of today, of the cities and towns and the other India, thousands of years old, is that of the village communities. As a foreign tourist in India, staying in five star hotelss and travelling by fancy cars, one is most likely to miss out on the second India, the truer of the two. Similarly, as a tourist in my own country, while I had often been to Agra to visit the Taj Mahal, what I did not realise was that I was missing out on a more humble, yet strikingly important part of our heritage.\xa0 Located a few miles away from the glorious Taj, on the Fatehabad Road, are the marble factories of Agra. One among these is Zainub Exports.', 'Engaged in a wide range of marble inlay work, workers at the Zainub Exports unit are treated just like family. It is, after all, a family tradition, an invaluable inheritance from the Mughal ancestors. Ask Mr. M. Ajeed Shirazi, a sixteenth generation entrepreneur and he will point out how his family has been running these factories since Mughal times. I listen to his narration but my mind has wandered off to another era, an era when the great ruler Shah Jahan added a grand legacy of structures during his reign. What must it have been like? Mr. Shirazi tells me how precious and semi precious stones used for the Taj Mahal were imported from all over the world, even in the seventeenth century. How much wealth, power and prestige must the royal highness have commanded? Then, I look at the humble figure in front of me. If it weren’t for Mr. Shirazi and his family, I might never have discovered the intricacies of marble structures and how it links us to our glorious past.', 'As a twenty-first century citizen, even though I am spellbound by the work of the artisans, I can’t help but ask the obvious question. Is there any money in the marble business? Mr. Shirazi hesitates, “This year the business was hit because of the slowdown abroad. Otherwise, we have many foreign tourists and clients who buy our products abroad.” From our discussions, I gauge that the major problem is that of marble sellers in bigger cities. They sell lower quality products, bringing down the price. How can a genuine product compete unless customers can spot and care for the difference? Problems cloud over the horizon. Yet, the satisfaction from this work is unmatched. For Mr. Shirazi, the work represents a culture, a legacy, a history he cannot trample carelessly. He holds it dear. There are always opportunities of work elsewhere, but he chooses to keep the glory of India untarnished. In the process, he helps many workers, who know nothing but marble.', 'Take the case of thirty-two year old Mohammad Haneed, one of the workers. Born and brought up in Agra, Haneed joined this work right after high school. Zainub Exports is providing livelihood to many such artisans. They also have a place to train workers and thereafter employ them. I am surprised to see how much these workers know about different types of marbles. They repeatedly tell me that the blue stone is semi precious Lapis lazuli. I can hardly pronounce it right. What was the orange one, I ask for the fifth time. “The\xa0orange stone is carnelian. It’s the one that shines when you put a flashlight against it,” comes the answer. While I am filled with awe and pride to see this hardworking group of people, at the back of my head, all I can think of is trying to remember what these stones are called! Next time, I don’t want to feel like a tourist in my own country.', 'Manufacture of Marble Inlay Work and Indian Handicrafts', 'Contact Details\nMailing Address:\n18/160A, Fatehabad Road, Purani Mandi,\nTajganj, (opp. Kailash Talkies),\nAgra-282001, Uttar Pradesh, INDIA', 'Email Ids:\nzainubexport@yahoo.co.in\ninfo@zainubexport.com\nwww.zainubexport.com\n\n\n\nFrom TBI Shop\n\n\n\n', ""Co-Founder of Serene Woods portal for authors and photographers, I have authored two books - 'Drenched Soul' (poetry) and 'If At All' (fiction). I am a freelance journalist for Times Ascent and enjoy blogging in my free time."", 'Get the best positive stories straight into your inbox!']"
5,2010-8,"['Archives', 'A toy in the hands of every child – Toybank']","['\n\n\nby\n\nRanjini Sivaswamy\n\n\nAugust 10, 2010, 2:21 pm \n\n\n', 'In most of our homes, in some corner, packed inside cardboard boxes, we have toys that lay unused and useless. \xa0Have you thought that they could bring joy to the life of children who never had toys to play with? Take them out of those boxes, wrap them up and send across to Toybank – you’ll feel a silent satisfaction sweep inside you.', 'Toybank is about gifting toys to those children who have been deprived of so many things, let alone the ‘luxury’ of toys. Agreed there is poverty and misery around, but can we afford to have children around us growing up unhappy? Shweta Chari, a young and energetic Electronics engineer, found a calling inside her and decided that she will bring fun and play into the lives of disadvantaged children. She founded ‘Toybank’ with an honest vision of placing a toy in the hands of every child in India and the world.', 'Shweta and her team of volunteers at Toybank started off gathering toys for street children in Mumbai. The very innocence of this initiative attracted fabulous response from people. Toys started flooding in and Toybank gift wrapped the donated toys with love and placed them in the hands of these kids. It might seem like a simple toy gifting idea, but there is an enormous mental, emotional and creative development that these toys trigger. Toybank started noticing that the kids were slowly opening up, began to feel important and wanted, and started expressing themselves better. Most of all, they had something that they could say was their own – a strong sense of belonging came along. As they grow, like we all remember some toy or the other that we played with, these children will also have a special toy to remember.', 'As Toybank takes up the role of an angel, they are very clear about one thing – we are not doing any charity, we are just giving the children access to their right. It’s the right of every child to have an enjoyable childhood and grow in the magical and imaginary world that toys create for them. “We at Toybank think that we are all pieces of a large jig saw puzzle; some fulfill basic needs of food, clothing and education\xa0while some like us focus on bringing happiness through play into the lives of children. The day all the pieces are put in perfectly and the picture is crystal clear,\xa0will be the day Toybank can shut shop.”', 'In the last six years, Toybank has made it possible for over 8000 kids to own a toy for themselves. Going one step further, Toybank is also taking initiatives to sensitize privileged kids about giving and joy of giving. They go to various schools and spread the good spirit of Toybank. Now that they have toy banks in Bangalore, Pune, Delhi, Bhutan and in the UK, Shweta wants Toybank to make a difference to the lives of children in rural India.', 'It’s a simple and beautiful contribution – donate toys and make a child smile. Visit www.toybank.org or write to mail@toybank.org.\n\n\n\nFrom TBI Shop\n\n\n\n', 'Get the best positive stories straight into your inbox!']"
