,month,heading,content
0,2012-11,"['Archives', 'TBI Heroes: Binalakshmi Nepram – Helping Gun Widows In Manipur Remake Their Lives']","['\n\n\nby\n\nAzera Rehman\n\n\nNovember 29, 2012, 10:00 am \n\n\n', 'It is the sad truth that women are widowed in Manipur on a regular basis due to ongoing violence. With no one left to support them financially, these women often find themselves unable to feed their families. Things are changing however, and due to the untiring efforts of one woman, there is now a support group for them which does not dole out charity but makes them capable of earning a livelihood.', 'Sometimes all it takes is one incident to transform one from being a mere spectator to a participant in change. For Binalakshmi Nepram, that moment came on a gloomy Christmas eve of 2004 in a village near Imphal, the capital of Manipur. As an academic researcher she was talking to a group of women activists, when gun shots shattered the peace. In the flash of a second, one of the women in that meeting – Rebika Akham, 24 – had become a widow.', 'Nepram recounts what happened, “We were at Wabgai. The gun shots sounded less than a kilometre away, leading to the death of a 27-year-old man.” The victim, Buddhi Moiranthem, had been dragged out of his car battery workshop by three assailants and shot at point blank range. To date, his wife and family have no clue about who his killers were, or what their motive was.', '“Rebika, all of 24, stood with us, shell-shocked. Amid the crying, I remember her mother’s helpless words, ‘Now how will I feed you?’ That was the turning point of my life,” says Nepram. It was then that she decided to set up a support system for women left isolated because of the violence around them.', 'Growing up in Manipur – a state that shares borders with Myanmar, as well as with the other north eastern states of Nagaland, Assam and Mizoram – which is possibly one of India’s most conflict-ridden regions, Nepram understood even as a child that life was uncertain given that armed violence was a regular occurrence. “My parents tell me that even on the day I was born, there was a conflict raging and my father had to scramble for the medicines that my mother had needed. Violence cast its shadows on our very minds,” she says.', 'When she joined the Jawaharlal Nehru University (JNU) in Delhi in 1997, she shared some of the realities of the region with friends and classmates, who often could not comprehend the extent of violence that marked everyday life in Manipur. “They could not believe it when I told them that people could actually disappear and not be seen alive again,” remarks Nepram. In JNU, Nepram began systematically researching into the situation, often travelling in the state to collect primary data. But despite her research, she was unprepared for those gun shots that rang out in 1994, changing a young wife into a widow in an instant.', 'Soon after that killing, Nepram collected Rs 4,500 to buy a sewing machine for Rebika Akham, so that she could earn an independent income and stitch together the pieces of her life again. With that the Manipur Women Gun Survivors Network also came into being. Nepram points out,', 'I realised there is no point in doing endless research if there was to be no intervention. There are so many young women, just in their twenties, who have been widowed overnight. Children have lost their fathers; mothers, their sons. These women needed help to start their life afresh.', 'She also realised that monetary relief was, at best, temporary relief and that soft loans were perhaps more appropriate. The Network then took on the role of providing small loans to women victims and helped them open their own bank accounts.', 'The lives of many women were turned around in the process. Take the case of Huidrom Tanya Devi, 18. Her father’s untimely death 10 years ago shattered her young life. A karate instructor, he was gunned down by the armed forces in 2001. The young girl still asks in a haunted voice, “Even today I don’t know the reason for my father’s death. I ask everyone, what crime did he commit to meet such an end?”', 'The Network gave her mother, Huidrom Geeta Devi a loan of Rs 3,000 in 2007 with which Tanya was able to start a small business. As the months rolled by, her confidence as an entrepreneur grew. This April, she became the proud owner of a shop that sells embroidered dress materials, incense sticks and household goods. Two other women have similarly set up their own shops with the Network’s help.', 'Mumtaz, another victim, whose husband, a lecturer by profession, was killed in gun violence in 2009, was in a similar distress. With five children to look after, she couldn’t be more grateful when the Network extended her a loan of Rs 8,000 to run her business.', 'Her success as an entrepreneur has whetted Mumtaz’s interest in public life. She now wants to contest the local panchayat elections in order to help bring change in her village in the Thoubal district of Manipur. She also links up affected women like her to the Network and is, in the process, contributing to the expansion of an initiative that had started small with 25 women survivors of gun violence and today reaches out to over a thousand.', 'The first of its kind in South Asia, the Network has 150 are active members, most of whom had been victims themselves. The assistance they render is multi-pronged. The immediate need of women who have been bereaved is a support system – some regular source of food, the continuation of their children’s education, and the like. Then comes the need for a sustainable income. Loans are provided to address this requirement, with the money put to use in setting up a small vegetable vending enterprise or acquiring a loom to weave cloth.', 'The Network also provides legal assistance to the women to fight their cases for justice and compensation since they themselves are most often too poor to afford lawyers. Medical assistance is provided to take care of the health needs of the affected women. The Network does this by entering into arrangements with doctors who are willing to provide free check-ups or dental care.', 'In order to function smoothly, meetings are held every two months in an informal setting – like the courtyard of a member’s house – to discuss individual problems as well as general issues, like the treatment accorded to widows in society. Nepram comments,', 'In many parts of India, when a woman who has lost her husband wears bright clothes or takes up employment outside the home, eyebrows are raised, questions asked, and motives ascribed. This is simply unfair – it is only right that women in such circumstances try and reclaim their lives. Girls, as young as 21, are widowed in an instant. Surely they have the right to live a normal life?', 'The Network meetings are not just to discuss problems, but are also meant as a time of togetherness over tea and snacks. The idea is to reach out and explore ways to address common problems. “We can only reach a limited number of women. If the government wants, it can connect with lakhs of them, but that would need political will,” observes Nepram. She emphasises that the Network is apolitical. In any case, politicians generally stay away from such interventions. Not only has no Member of Parliament come forward to be associated with the work the Network is doing, ministers in Manipur have actually mocked its efforts. But for Nepram this only points to the great lack of sensitisation among politicians to the gender dimensions of violence.', 'The lack of political response has not, however, discouraged the women members of this unusual Network. Right now, they are busy studying government schemes for women and children and searching for ways in which they can benefit from them.', 'Get the best positive stories straight into your inbox!']"
1,2012-11,"['Archives', 'TBI This-Ability: Rahul Cherian – Working Towards An Inclusive Planet']","['\n\n\nby\n\nMalay Desai\n\n\nNovember 27, 2012, 2:28 pm \n\n\n', 'There are some who crib about laws and then some who help make them better. Rahul Cherian belongs to the latter. A partner at a Chennai-based law firm specialising in intellectual property rights and other laws, he is also the force behind Inclusive Planet, a centre that connects the disability sector with the government and policy makers.', 'The 38-year-old is a cancer survivor himself. After having surgically removed it from his spinal cord in 1989, he underwent reconstructive surgery in 2005 and now uses crutches. Today, Cherian is one of the experts drafting the Treaty for Visually Impaired persons currently being negotiated in Geneva, where he loves driving his hand-controlled car. We caught up with the man to know about his peculiar routines, insights about law-makers and his pet project, a social network for blind persons.', 'What’s your regular day like? Is policy-making and law stressful?\nI don’t keep a regular schedule because I invariably end up breaking it! Most days I’m found working till midnight and yes, it is very stressful managing all these diverse activities.', 'How diverse are your roles at Indojuris and Inclusive Planet? What are your motivating factors at both?\nThe roles are completely diverse. At IndoJuris, the deliverables are within my control, whereas at Inclusive Planet, as there are so many moving parts including the government and the disability sector, I have to be extremely agile most of the time in what I do. Moreover, policy making has a longer gestation period and at times there is a flurry of activity in each area and then there are lull periods. It can be frustrating at times… but can also be extremely rewarding when the policy I have been working on becomes a reality!', 'In this hyper-connected world, where does your ‘social network for visually impaired persons’ stand? How many people is it still relevant to?\nInclusiveplanet.com is specially designed for persons with visual impairment to interact with each other in a digital environment. It’s fully accessible for all who use screen readers. In an era of Facebook, here we have a one-of-a-kind social network that has the potential to impact millions of visually impaired persons from around the world!', 'Tell us how your legal and policy work plays out. \nSee, I get requests from the disability sector, I pick the relevant ones and help conceptualise them. Then, we prepare documents; raise funding if required, meet MPs if that helps. For instance, a disabled person once wrote in when the Centre was drafting a new aviation policy, and thought we must intervene. We researched and wrote to them. People do not recognise that every law has some impact on persons with disabilities, whether it’s related to banking, air travel, education, electronic delivery of government services etc. I am up to try and change these laws and policies.', 'Is working with the state difficult? Must a common disabled person need strong contacts to see change?\nIt’s not as tough as it seems! The machinery of some states is smoother than others. We get requests from governments too; the Kerala Planning Board wants to make the whole state ‘inclusive’ by 2025. We’re planning actively with them… and they’ve already allocated 40 crores for it.', 'I’ve found many politicians and bureaucrats to be very committed too, provided you do all the leg work! Before the Copyright Act amendment, we had met a CPI-M member of the Rajya Sabha, who promptly arranged further meetings and we now have an important bill passed.', 'What does this Copyright Amendment Bill 2012 mean for the disabled?\nIts biggest takeaway is that now persons with disabilities will be able to access reading material on an equal basis with others. Also, the government cannot hide behind copyright restrictions to deny educational books to students with disabilities.', 'A major learning for me here was to understand how to convince Members of Parliament on disability related issues. The secret is to practically demonstrate the possibilities of an enabling law rather that an emotional or legal argument.', 'Does being a person with disability yourself help you here?\nI’ll be frank and say yes. It does help get more legitimacy from within the sector. Otherwise you know how lawyers are looked at! You do have an edge when you meet a bureaucrat, but then it of course depends upon your approach and research.', 'How has it affected you personally though? \nI don’t think that being a PWD has affected my career or my emotional state.', 'Get the best positive stories straight into your inbox!']"
2,2012-11,"['Archives', 'TBI Change-makers: Dr. Ram Kataria – The Man Who Created The Gandhians Farm']","['\n\n\nby\n\nShruti Nambiar\n\n\nNovember 23, 2012, 11:01 am \n\n\n', 'Dr. Ram Kataria has dedicated 12 years of his life in converting a barren patch of land in the parched interiors of Maharashtra into an oasis using innovative and indigenous methods of conservation and sustenance. What’s more, he has many more ideas for inclusive growth including the creation of a school for rural change-makers. Meet the man with boundless energy and infinite vision.', 'For decades, Dr Kataria had a comfortable medical practice and a beautiful home in Manchar, off Pune. But when his two sons moved out and found their own feet, he started planning on acting on an issue that had long troubled him. He had always been close to nature, and passionate about gardening. But at the same time, he was disturbed by the environmental legacy his generation is set to leave behind for posterity. He decided to sell his house and relocate to a place where his vision for change could take shape.', 'The shift happened in 1999. Dr Kataria bought out tracts of land owned by family members and partners, and ultimately had to his name an expansive, bone-dry patch that covered 100 acres in Kadus gaon in Taluka Rajgurunagar, about 50-odd kilometers from Pune. He still recalls being called “crazy” by friends and family alike when he let go of his home. “But my madness is my strength,” he chuckles.', 'More than 12 years have passed since The Gandhians Farm first started taking shape. Dr Kataria conceptualised the look and landscaping of the place, and roped in the labour of villagers living around. Together they spent countless hours in mud and sunshine, planting and nurturing the over one lakh trees and plants that stand there today. Some of these villagers have built humble homes inside the farm. Depending on the season, 50-70 people could be working in the farm at the same time. The untiring doctor himself is on the ground at 6am daily, and walks around the sprawling farm, planting more saplings, watering the plants, clearing stray twigs from the many narrow paths that criss-cross the farm, and chiding the people around him for littering.', 'Though the most obvious change is the farm itself, the impact of what Dr Kataria has started is more widespread, and multi-pronged. The Gandhians property’s heart is in conservation, not just of the environment, but of the human resource too. Says Dr. Kataria,', 'It is important to harness the local human energy. People who stay in the rural areas are the true producers, and we need to develop ways to keep them here and not migrate to the cities. We need to give them jobs, build their confidence, and help inspire and hone interests.', 'He sums up his vision in six words – Swaccha (clean), Sundar (beautiful), Green, Sajala (redolent with water), Sashakt (self-sustaining) and Anandi (happiness).', 'The Gandhians Farm is remarkably self-sustaining in terms of its water usage, well provided by its 11 rain-fed mud dams. Most of the close-to-100 species of plants in the farm are carefully selected local species, with other additions from outside being fruit trees like papaya and sitafal. Some trees have been planted to provide nesting grounds for an interesting number of birds. Water is a precious commodity in this area with 800mm of average annual rainfall, and an excruciating number of hours of electricity load-shedding. Water conservation is therefore paramount – the farm uses a drip irrigation system, and re-uses as much water as possible. “You don’t need to employ major expertise to conserve; simple, local techniques are just as effective,” says Dr Kataria.', 'As the farm gradually found its feet, Dr Kataria realised that people need to come in and see what is possible. So, when the\xa0Pune-located, community-based travel company\xa0Black Swan\xa0approached him with the idea of a day-trip, he was thrilled. “It makes me glad, that young people are interested in knowing about this.” Six years ago, his son Anand initiated the building of an eco-friendly resort called Ananda Valley within about a third of the area of the farm. This place offers eco walks across the farm, and has attracted a steady influx of people every week.', 'But Dr Kataria’s boundless energy is the beating heart of this place. The soft-spoken doctor can hold forth on subjects ranging from the sad state of Indian rural health, to Anna Hazare, to Bollywood – all in the course of one conversation. Apart from running the farm’s activities, Dr Kataria continues to practice medicine three days a week in Manchar. He has been a family physician for 45 years, and harbours a deep interest in the subject of psychology.', 'In the midst of all this, a new idea has managed to take hold of his conscience. “I want to help build a grameen vidyapeeth where anyone who has an idea for change can come and learn how to realise it. The vidyapeeth will have people who will assist every prospective change-maker with know-how and constant guidance,” says Dr Kataria.', 'The most critical aspect of this project is of finding the right spot to build the vidyapeeth in – a preferably hilly area, with a 200 acre spread close to the tehsil. “The cities have all resources readily available to them, and the city-dwellers have no time to spare. They don’t need us! The change has to begin in the rural interiors of our country, and villages need to be made viable. This will not be an organisation, but a movement. It will utilise the expertise of retired people and help address the root cause of all social problems,” Dr Kataria says.', 'This change-maker is always on his toes, always willing to learn, and will always remain an inspiration. “As citizens, the changes that we wish to see around us, must reflect in our personalities as well,” he always likes to say.', 'Get the best positive stories straight into your inbox!']"
3,2012-11,"['Written by Gangadharan Menon', 'TBI Art & Culture: The Warlis – The painting is on the wall']","['\n\n\nby\n\nGangadharan Menon\n\n\nNovember 21, 2012, 10:25 am \n\n\n', 'Warli Art is a lot more than those stick figures you see in art stores these days. Gangadharan Menon takes us on a rich voyage of discovery where he unearths the history, meaning and evolution of Warli Art. And he does this in the most interesting way possible – by meeting and studying the Warli tribe: their traditions, folk tales and everyday life!', 'It all started four decades ago: in the early 70s. Pupul Jayakar, the woman who unearthed many an Indian folk idiom, along with her field assistant Bhaskar Kulkarni, was on a voyage of rediscovery. First they rediscovered the rich and colourful Madhubani art, and then the amazingly spartan idiom of Warli art that shunned the use of all colours except two: brown and white.', 'Jivya Soma Mashe, one of the accomplished Warli artists of the time, was invited to New Delhi for a demonstration of their art. In front of unbelieving eyes, on a sheet of brown paper, Jivya drew the figure of Paalghaat, the Goddess of Fertility, sitting in the centre of an intricately drawn temple. When prodded to draw more visuals, Jivya drew a blank. He sheepishly admitted that this is all that every Warli artist knows to draw: the ritualistic drawing of the Goddess which is painted on the walls of a Warli house on the day of the wedding.', 'According to Phiroza Tafti, the convenor of the Dahanu Chapter of INTACH, Jivya was encouraged by Pupul Jayakar to break the shackles of convention and depict the rich mythology and the evocative legends of their tribe in their own inimitable Warli style. Jivya came back to his native village and had a meeting with other fellow artists. And once liberated from the strict traditions of ritualistic paintings, the floodgates were opened and out flowed thousands of distinctly different Warli paintings: depicting their myths, folk tales and daily life. And Warli art moved from the depictions of god to the depictions of mortals.', 'On our visit to Dahanu in the North Konkan belt of Coastal Maharashtra, Phiroza Tafti offered to take us around the padas, or the villages, of the Warli tribe and share her experiences with us. Right from the time she came to Dahanu as a newly-wed city-based rebel who made the chickoo orchard of her husband Jehangir her permanent home.', 'A pilgrimage to the Waghoba Mandir was first on the list. Here we saw idols carved on totem poles. The totem pole was a relic from pre-historic times and the idol was a symbol of their contact with the rest of the world. Originally, the Warlis never worshipped man-made idols. The shaman of the village on his sojourn to the nearby hills would pick up small rocks that spoke with him in positive tones. These would be kept under trees, and they would then become their places of worship. Over many centuries, influenced by mainstream religions, the weather-beaten stones eventually took man-made shapes and temples were built around them.', 'While inside the shrine of the Tiger God Waghoba, Phiroza insisted that we sit down and feel the vibrations of the place. And indeed as we closed our eyes in deep meditation, a certain calmness soothed our souls. Was it the sound of the brook that flowed nearby that we heard, or was it the sound of the stream of consciousness?', 'The Warli people are a simple folk with simple beliefs that govern their lives. According to Yashodhara Dalmia, an authority on tribal arts and anthropology, the Warlis are frugal in their habits and speech.', 'A Warli woman, before she cooks supper, asks her family members how many ‘bhakris’ would each one of them eat that night. And she would then make exactly that number. When Yashodhara asked the woman why she does this every day, day after day, the woman replied, `These bhakris are cooked on the back of Kansaari, our Goddess of Harvest. Why give her more pain than what’s necessary?’', 'Another unique character of this tribe is that they speak very little, almost in monosyllables. That’s because the Warlis believe that words have an uncanny habit of suddenly becoming real. So they ensure they don’t speak anything untoward lest it becomes true!', 'Probably in sheer contrast to this frugality, every Warli artist pours his heart out while painting. Though the figures are graphic, devoid of details and colour like cave paintings, they are surprisingly rich in their choice of subjects: human figures in various situations, gods, trees, plants, and animals both wild and domesticated. Even the minutest ant finds place in their paintings. As Yashodhara puts it so succinctly, `They are rich, yet hieroglyphic in effect.’', 'Since Phiroza had to rush off to the school where she teaches, she assigned us to Yashode, her trusted Warli maid of 30 years. Yashode turned out to be more Warli than most: in terms of using words. While giving directions as I was driving, she would just point her hand to the left or the right without speaking a single word!', 'She took us to the house of Jaanu Ravte, a promising young Warli painter. First he took me to his studio, which he shares with six other artists of his co-operative. Then, after a cup of tea, he took us around his house that was barely lit by a skylight on the tiled roof, and a lone, small window. It was a wall such as this, smeared with mud and cow-dung, that was the original canvas of Warli art. And staring at that dingy wall, I understood why the Warlis don’t use colour but a white, rice-based paint to create their artworks. The sparkling white of the rice-paint gleams in the under-lit house, catching even the faintest of sunrays that come in reluctantly. Giving the painting a truly ethereal feel.', 'Seeing Janu paint was a revelation. His hand was an extension of his mind, and his brush was an extension of his hand. It started with a basket and around it he weaved a tapestry of Warli life, all in a swirl of perpetual motion.', 'Today, in response to the art market, villages after villages have taken up Warli painting; and in many cases the raw, creative energy has been replaced by static, decorative motifs that are saleable. Underlining the fact that a painting becomes a work of art only if it’s created by the forces inside, and not the forces outside. And it’s left to artists like Jaanu to uphold the fabulous traditions that have been transferred from one paint-brush to the next, across generations.', 'Gangadharan Menon is a nature writer, art teacher, and photographer of the wild.', 'Get the best positive stories straight into your inbox!']"
