,month,heading,content
4,2012-11,"['Archives', 'Shishu Sarothi – A Friend To Children With Cerebral Palsy And Related Disabilities']","['\n\n\nby\n\nPriyanjana R. Das\n\n\nNovember 19, 2012, 10:19 am \n\n\n', 'Shishu Sarothi is an award-winning NGO based in Assam, reaching out to children with cerebral palsy and related disorders. The care and love given to these children was apparent to the author, when she spent a summer interning there, and came away with memories that will never fade. These children are coming to Delhi to perform a play on the 20th November. Be sure you are there to encourage and cheer them.', 'Around two summers back, my friend and I decided to spend our summer in Shishu Sarothi, Guwahati. Shishu Sarathi is a centre for Rehabilitation and Training for multiple disability and has been reaching out to many children of Northeast India since 1987.', 'It began as a non-profit organisation in 1987 at a time when the nearest facility for intervention and management of children with cerebral palsy and its associated disabilities was located in Kolkata. Shishu Sarathi in fact became the first institution in Assam to cater specifically to the needs of children with cerebral palsy.', 'I interned there for two months and I recall that summer as my best ever. I was exposed to a whole new world of people. The children were arranged in different classes according to their progress. We spent time teaching them how to paint, play, add numbers, draw, color and worked on making them independent in doing their own day to day activities.', 'Without knowing, they welcomed us into their world and made us a part of it with so much trust, love and ease. These children were wild and free and were always full of courage. They wore their guts on their sleeves. I have never seen fear in their eyes, they were always on the move, wanting to learn more, explore more and do the impossible. Performing stunts was the common craze with most of them there, leaving us fascinated and enchanted by their spirit.', 'Every morning when i reached there, they would welcome me with their best smile, hold my hand and drag me inside the class. They enjoyed their activities and since painting is my favourite, I partially dragged them into the world of colors and in turn they taught me how never to bother about what you want to paint but be really proud of the outcome, whatever it turned out to be. These kids loved to laugh and they would do anything to make you laugh your hardest.', 'They made it very difficult for me to stay in one class for long. I wanted to be in every class with everyone all the time. It was a pleasure spending time there and I never wanted my internship to come to an end. These children taught me how to love and how to be brave. They were trained really well and groomed very properly. Both the teachers and students in the institute worked hard and shared such a strong bond that it was difficult not to love and admire them.', 'On the last day of my internship, One of the little girls went all over the institute to find her phone number to give it to me so that I wouldn’t forget her. With their little gestures, they win everybody’s hearts and teach them how to love, how to accept and how to trust.', 'Shishu Sarothi has received the Best Institution Award from the President of India in 2004 and the State Award for Best Community Service from the Chief Minister of Assam In 2007. It has served the society with pride for 25 years now and held its Silver Jubilee celebrations on May 1, 2012 with a concert, the highlight of which was B V Karanth’s Kannada play Buddhuram, directed by national award winning theatre artiste Bhagirathi of Seagull Theatre.', 'The idea of performing the play had its genesis in the knowledge that performing arts can be both therapeutic and motivational for children with disabilities. As Bhagirathi says,', 'In my career as a theatre artist, I have learnt more from the hidden talents of the children at Shishu Sarathi than what I have taught. They have completely changed my views about life. Directing performances for these special children has been a great challenge and even as I try o bring out their best, I realise how wonderfully talented they all are.', 'Buddhuram is a play about a pair of children realising the practical aspects of life and their own shortcomings. These children are coming all the way to Delhi from Guwahati to perform the play on the 20th of this November at Abhi Manch in National School of Drama at 6 PM. I would request all of you to join in, enjoy, boost their confidence and encourage them.', 'Get the best positive stories straight into your inbox!']"
5,2012-11,"['Archives', 'TBI Social Enterprise: Art that Empowers – Pioneering Change through Partnerships']","['\n\n\nby\n\nMariam Noronha\n\n\nNovember 12, 2012, 12:11 pm \n\n\n', 'Grannies making hand-knitted and crocheted baby garments, female artisans weaving dreams out of lovely threads, rural artists shaping their future with hand-crafted pottery and home accessories – these are just some examples of urban, educated youth partnering with rural and marginalised groups to create sustainable social enterprises that empower and enrich their lives.', 'How many of us look around and see problems? All of us I guess. Poverty, unemployment, latent skills, dying arts and the like are all around us. While they are problems, not all of us are able to see the solutions that lie therein. It’s all a matter of changing your perspective. “Be the change you want to see”, these words of Mahatma Gandhi are what we need to start making a change.', 'This article is about people and their ventures that have chosen to be the change they want to see. Using art to empower people across India, they are successfully pioneering change through partnerships.', 'Lima, an NID alumnus has created Granny’s Love, a unique venture that brings together elderly ladies with a flair for knitting and crochet. Presently a team of 7 grannies who are creating knitted and crocheted baby garments, this is a unique venture that provides gainful employment to grannies. An endeavor that not only makes a difference to the lives of grannies but also creates unique and handcrafted baby garments with dollops of love thrown in.', 'What strikes me as unique about Lima’s initiative is her ability to have spotted the talent that these women have and bring it to the fore by partnering with them. A lot of us have grandmothers at home and our neighborhoods blessed with a skill, but not many would have thought of a venture like this!', 'House of Wandering Silk, a venture born out of the myriad experiences of a Czech/Australian aid worker in 2011, is a tribute to Asian textiles and embroidery. After 7 years of work in Africa, Asia and the Middle East, she saw very little difference in the lives of the poor despite efforts and resources dedicated to the cause. This prompted her to come up with a sustainable solution to artisans and weavers. Based in New Delhi, House of Wandering Silk is a social enterprise driven by the single minded determination of one woman to reduce some of the inequalities that we see around us.', 'Telling the story of silk together with hand-woven cotton, hand-spun pashmina and wool and other beautiful “green” textiles, House of Wandering Silk is taking beautiful weaves and fabrics from producers and turning them into delightful one-of-a-kind clothing, accessories and home décor items embellished by the nimble fingers of female artisans. Their target market is the discerning group of customers who seek design excellence and quality while appreciating products that enrich the lives of those who create them.', 'The House of Wandering Silk model is an inspiration to many who want to make a difference and empower artisans while creating sustainable employment opportunities.', 'While volunteering in the aftermath of the 2001 earthquake in Kutch, Gujarat, Neha Gandhi had the opportunity to take a closer look at the traditional arts and crafts of the region. From the debris that surrounded her, Neha was inspired to build Matsya Crafts, a platform to empower artisans while creating beautiful and functional products with a traditional yet contemporary edge.', 'Today, Matsya has evolved in to a team of marketers, design enthusiasts, art lovers and well-wishers all of whom are working together to bridge the gap between artisans and urban customers. Neha and her team work to curate a wide range of products for the home and interiors. Furnishings, studio pottery and accessories are just some of the Matsya products you will find on sale both online and at exhibitions.', 'In their own words, their goal is to preserve, revive, and expand the rich tradition of rural handicrafts by working closely with artisans, helping them develop quality products that appeal to contemporary tastes. They also organize craft tours, undertake craft documentation and partner with NGO’s.', 'Hands of India (HoI), the collective dream of two sisters, Malyada and Ramya is driven by the immense passion and love that this duo has for the handicraft tradition and the artisans who create them.', 'Determination to preserve sustainable natural processes while making the best products drove Malyada and Ramya to set up this venture in 2003. Having spent some time working in the corporate sector, the sisters are now working to promote Indian handicrafts.', 'Why handicrafts you ask the? They say “The strength of the Indian handicraft industry is its cottage nature; low entry barriers combined with marginal capital needs (mostly not always), the strength of his hands are all an artisan needs to get started.” For a country of 1 billion people this they say is a very good model.', 'I hope these stories woven with threads, fashioned out of clay and etched in stone inspire every Indian to look around and be the change. Not all of us can create such ventures but we can support them in some way. You can too by:', 'These are just a few of our suggestions. We are sure you can come up with many more!', 'Get the best positive stories straight into your inbox!']"
6,2012-11,"['Archives', 'TBI Heritage: A Glimpse Into The Rock-Cut Art of Elephanta Caves']","['This is not a story in the true tradition of The Better India. This is not a tale of inspiration or a reason to celebrate human courage or spirit of innovation. This is a call to action. We will be doing this from time to time. So that we do not become too complacent. So that we do not forget that WE also need to do something to shake up the current state of affairs, to improve things around us, to BE the change-makers instead of only reading about them. There are issues like these which need our urgent attention, before they are lost to eternity, and WE NEED TO ACT TODAY! We would love to know your thoughts on how we could, as a community, take responsibility for our monuments and heritage .', 'UNESCO World Heritage Site, Elephanta Caves, dating back to 4-9 AD, lies 7 km from the shore on the mainland of Elephanta Island while the Island, originally named, Gharapuri/ city of caves, lies about 11 km north-east of Apollo Bunder in Mumbai. Carved out of solid rock, the Elephanta caves feature some of the most impressive statues of Lord Shiva, in his various forms and avatars.', 'Except during the monsoons, the ferries leave from the Gateway of India around 9am in the morning in every half an hour duration while the last ferry from the caves leaves around 5.30pm in the evening, on all days except Mondays. Thousands of tourists, who come to Mumbai, make it a point to explore this historical site. The entire sea journey to the caves is breathtaking, especially the view of the huge ships standing tall in the midst of the huge Arabian Sea and the scenic view that the vast sea offers to the tourists.', 'In 1534, Elephanta along with the islands that were to constitute Bombay went under Portuguese control. By then sections of the caves were already in ruin, damaged by weather and nature’s forces. It is reported that target practice by soldiers may have also damaged a few sculptures. Later, the Marathas occupied the island in the 17th century. In 1774, the English took control of the island. Unchecked destruction within the cave site continued under British rule and it was not until 1909 that the main cave was declared a protected site under the Ancient Monuments Preservation Act.', 'The sculptures in these caves are considered representative of ancient art forms – especially that of the Chalukyan empire and the Gupta kingdom. The three temples stretch out from Stupa Hill to Canon Hill, but it is the temple in the centre – the Main Temple – that is grand and exquisite. It’s dedicated to the Hindu god Shiva (the Destroyer in the Hindu Trinity), and showcases Shiva in all his different forms. Massive square-sided pillars support a ceiling that is believed to have originally been painted. Right opposite the entrance, dominating the wall, is a huge sculpture that depicts Sadashiva, the three faces or embodiments of Shiva. There are other depictions of Shiva too – as Nataraj, performing the cosmic dance of destruction; as Yogeshwar, the lord of yoga; as Ardhanareeshwara – half man and half woman and – in his most romantic form – as Kalyanasundara, the loving and gentle bridegroom in his wedding with Parvati. All of the sculptures, including those of the eight dwarapalas (guards of the gate) surrounding the sanctum sanctorum with its Lingam, are intricate and beautifully decorated.', 'In addition to being a seat of culture, Elephanta is an ecological treasure, home to myriad species of fauna. Kingfishers, Pond Herons, Plovers, Magpies, Kites, Bulbuls, Drongos and Minivets, Paradise Flycatchers, Rhesus, Bonnet and Macaque species of monkey as well as numerous butterfly species can be easily found on the island and its forests. However, today the island has become more of a fragile zone getting highly impacted by the industrial developments from Jawaharlal Nehru Port Trust, Butcher Island, petrochemical installations, the nuclear plant at Trombay and the Bhabha Atomic Research Centre. Besides, plastic bags flutter outside the caves and the tetrapacks can be seen floating around the water cistern damaging much of the environment of the island and posing a danger to the survival of the rich and rare species.', 'To the right of the main cave, an asbestos sheet is fitted in an attempt to ensure the water from the roof of the caves flows into a natural well below. The ASI installs the sheet every monsoon. The caves are cleaned using chemicals. However, the defaced head of a lion that stands guard at the lingam shrine in the east court of the main cave shows that the caves lack adequate protection and upkeep. The question then remains as to what happens to the funds that are given to protect the caves. The main planning goes around utilising the grants from the government to install dustbins, create garbage pits, beautify the jetty, build toilets and put up signage across the island. Graffiti is widespread and water seepage is an issue the Archaeological Survey of India (ASI) is struggling to cope with. Further, ad-hoc construction has led to mismanagement on the island. It is quite evident that the area requires stricter regulations and proper utilization of monetary resources.', 'Nearly 90 per cent of locals thrive on Elephanta tourism. The closure of a heritage site such as this is not only unimaginable and beyond reason but would also pose a big economic trouble to the locals of the island and to the image of India’s tourism in general. The caves are too precious and sacred to be lost.', 'As protectors of the world’s heritage, archaeologists need government support to protect these historical sites which are in a debilitated state. They can’t fight on their own to save the monuments but we as citizens together can help them in protecting our precious sites so that the future generations are able to get a glimpse of our rich heritage.', 'The question then is will generating media awareness around the state of our crumbling heritage spots actually improve the lot of the ASI, and help in preserving a few more collapsing monuments? We certainly hope so, and this is our effort in that direction.', 'Get the best positive stories straight into your inbox!']"
7,2012-11,"['Archives', 'Bijli Bachao – Now Save On Your Electricity Bills And Learn Of Energy Efficiency']","['To the world, Abhishek looked like a happy content professional working with one of the largest consulting firms in the world. Armed with an IIT degree, that is how it was supposed to be or that is how everyone thought. It was the year 2008, he was working with Deloitte, USA; he married Manisha, an energy efficiency engineer working with TERI. Together they came back to India in the year 2009 and little did he know that she will provide the fuel to the energy inside him. They bought a house like any other couple and started setting it up. Manisha was careful about what to buy and what not. The attention she paid to the kind of lights, refrigerator, air-conditioner to be put in the house was immense. Abhishek took the cue. He always wanted to do something on his own, now with Manisha’s interest and expertise in energy efficiency, he knew exactly where to begin. He quit his job with Deloitte and dedicated himself fully into the concept of energy efficiency.', 'Energy efficiency has been identified worldwide as the least cost measure for climate change mitigation. One of the major challenges that energy efficiency in India faces is lack of credible information to the consumers. The challenge is even bigger for smaller consumers such as households, small offices/shops and SMEs. While there are a wide range of options available to consumers to save electricity and reduce bills, many a times, they are not aware of these options. Government undertakes various initiatives to promote energy efficiency in small consumers by way of awareness creation, appliance labeling, discount/exchange schemes on appliances etc. However, it is observed that despite the large benefits that the consumer will get, the uptake of such schemes is very low. Two of the most common reasons are 1) the consumers do not get to know about the scheme 2) the consumer do not understand how the scheme will benefit them and how much will they save in their bills.', 'Due to increasing costs of electricity in all the parts of the country, there is an increased willingness to learn ways to keep the consumption in control. In order to do so, it is essential to first monitor the consumption. It requires knowing your appliances, how much should they consume, how much do they actually consume and is there a scope for reducing. It is important to make a note here that energy efficiency is different from energy conservation. In energy efficiency, the same level of comfort is derived from efficient use of energy.', 'How does Bijli Bachao help us achieve Energy Efficiency?', 'With the backdrop of energy efficiency as the concept, Abhishek launched a website – www.bijlibachao.in. The site was intended to disseminate information about how to use various electrical appliances and to help people understand how much they are spending on various appliances. Abhishek and Manisha themselves undertook experiments and then shared information on how electricity could be utilized in the most efficient way. It gives small and important details like what temperature should the AC be set on or where the refrigerator in a house should be placed. The site extensively also covers how to read the electricity bill. In fact, Abhishek himself makes a point to read his own electricity bill and compare it with his neighbors. In any given month, when they spend close to Rs.1500, the neighbors end up paying Rs.6000. After spreading awareness broadly about energy issues, he plans to gradually move to finer details. For example, an electricity bill calculator has been put up on the site which any person may use to understand the components of the electricity bill for a residential unit including the expenditure on each appliance. This will be eventually developed into a calculator that can be used for commercial complexes as well.', 'Since its launch, the website has garnered a lot of interest and gets several visitors in a day. Estimating the actual impact of such visits on changes in patterns of usage will be definitely very difficult. The impact will be different for different types of consumers. There will be some consumers who are completely unaware of the concepts of saving electricity and the website helps them take their first step for saving. There will be others who are looking for specific information about specific appliances and the website helps them by providing such information.', 'But for Abhishek and Manisha, the work does not stop here. They want to get to a level where they can help people completely decode their electricity bills, and understand where they are spending more, and how it can be reduced. They are building several software components for the same, some of which (for refrigerators, water heaters, fans and lights) are already available on their website. Along with the software, the tips on the website help in understanding how electricity consumption can be reduced for various appliances. They have also started a monthly newsletter where they provide latest updates and newest electricity saving tip on the website along with seasonal tips.', 'As part of their initiative they are also planning to start a service ‘help@bijlibachao’ where individuals can contact them on Internet and get their problems related to electricity savings resolved. The service will be more personalized and they will provide tips relevant to the person asking for help. They have also started working with residential societies in Mumbai, helping them save electricity and trying to work out ways to reach out to many more societies in the country.', 'At later stages, Bijli Bachao plans to offer its stakeholders many more products and services in this space. The stakeholders will include manufacturers and suppliers of energy efficient products in addition to energy consumers and also policy makers. Some of the future products and services will include online audits, database creation and management and a market place for energy efficient products.', 'Bijli Bachao is a small step from ignorance to awareness in the wake of the rapidly depleting resources of the nation. It dreams of helping India towards sustainable development, an India where there is electricity for all, an India where there are no power cuts and an India self-sufficient in meeting its own energy needs.', 'Get the best positive stories straight into your inbox!']"
